NIVEL,NOMBRE,TURNO,DOMICILIO,COLONIA,ALCALDÍA,SOSTENIMIENTO,ubicacion,lat,lon,coordenadas
Preescolar,MI MONTESSORI,MATUTINO,GALILEO NO. 329,POLANCO REFORMA,MIGUEL HIDALGO,Particular,"GALILEO NO. 329, POLANCO REFORMA, MIGUEL HIDALGO",19.4367195,-99.1921463,"19.4367195,-99.1921463"
Preescolar,JARDÍN DE NIÑOS MULTICULTURAL LONDRES,MATUTINO,LONDRES NO. 44,JUAREZ,CUAUHTEMOC,Particular,"LONDRES NO. 44, JUAREZ, CUAUHTEMOC",19.42723,-99.1598533,"19.42723,-99.1598533"
Preescolar,"INSTITUTO PEDAGÓGICO KAHLO DE MÉXICO, A.C.",MATUTINO,AV. HOMBRES ILUSTRES NO. 674,SANTA CECILIA TEPETLAPA,XOCHIMILCO,Particular,"AV. HOMBRES ILUSTRES NO. 674, SANTA CECILIA TEPETLAPA, XOCHIMILCO",19.218939,-99.0979213,"19.218939,-99.0979213"
Preescolar,COLEGIO REAL CALMECAC,MATUTINO,AV. TLAHUAC NUM. 3993,CULHUACAN,IZTAPALAPA,Particular,"AV. TLAHUAC NUM. 3993, CULHUACAN, IZTAPALAPA",19.3283336,-99.1054554,"19.3283336,-99.1054554"
Preescolar,COLEGIO NOIL,MATUTINO,AV. SAN FRANCISCO NO. 520,SAN FRANCISCO BARRIO,LA MAGDALENA CONTRERAS,Particular,"AV. SAN FRANCISCO NO. 520, SAN FRANCISCO BARRIO, LA MAGDALENA CONTRERAS",19.314072,-99.2336352,"19.314072,-99.2336352"
Preescolar,PREESCOLAR WINSTON CHURCHILL,MATUTINO,SAN JUANICO NO. 64,EL TRIUNFO,IZTAPALAPA,Particular,"SAN JUANICO NO. 64, EL TRIUNFO, IZTAPALAPA",19.374148,-99.1202261,"19.374148,-99.1202261"
Preescolar,COLEGIO HUMANISTA DE LAS AMERICAS,MATUTINO,"CALLE 24 DE MARZO DE 1857 MZ. 187, LT. 2209",LEYES DE REFORMA,IZTAPALAPA,Particular,"CALLE 24 DE MARZO DE 1857 MZ. 187, LT. 2209, LEYES DE REFORMA, IZTAPALAPA",19.3789665,-99.0778952,"19.3789665,-99.0778952"
Preescolar,CENTRO PEDAGÓGICO COYOACÁN,MATUTINO,TOLTECAS MZA. 7 LOTE 19 BIS,PEDREGAL DE SANTO DOMINGO,COYOACAN,Particular,"TOLTECAS MZA. 7 LOTE 19 BIS, PEDREGAL DE SANTO DOMINGO, COYOACAN",19.3233704,-99.1625619,"19.3233704,-99.1625619"
Preescolar,JARDÍN DE NIÑOS PATITA LARGA,MATUTINO,LA PALMA NO. 69 ANTES 13,TIERRA NUEVA,XOCHIMILCO,Particular,"LA PALMA NO. 69 ANTES 13, TIERRA NUEVA, XOCHIMILCO",19.2651383,-99.1182923,"19.2651383,-99.1182923"
Preescolar,"JOY LAND, S.C.",MATUTINO,RALPH WALDO EMERSON NO. 516,POLANCO SECCION V,MIGUEL HIDALGO,Particular,"RALPH WALDO EMERSON NO. 516, POLANCO SECCION V, MIGUEL HIDALGO",19.4298585,-99.1888555,"19.4298585,-99.1888555"
Preescolar,DIANITA,VESPERTINO,CAMINO A SANTIAGUITO NO. 15,PROGRESO NACIONAL,GUSTAVO A. MADERO,Particular,"CAMINO A SANTIAGUITO NO. 15, PROGRESO NACIONAL, GUSTAVO A. MADERO",19.522816,-99.1648834,"19.522816,-99.1648834"
Preescolar,BRIGHT HOUSE,MATUTINO,AV. HIDALGO NO. 95,DEL CARMEN,COYOACAN,Particular,"AV. HIDALGO NO. 95, DEL CARMEN, COYOACAN",19.3509617,-99.1545309,"19.3509617,-99.1545309"
Preescolar,CEIBI CENTRO DE ESTIMULACIÓN INTEGRAL PARA EL BIENESTAR,MATUTINO,"SAN ISAURO S/N. MZA. 924, LT.10",SANTA URSULA COAPA,COYOACAN,Particular,"SAN ISAURO S/N. MZA. 924, LT.10, SANTA URSULA COAPA, COYOACAN",19.3118663,-99.1556053,"19.3118663,-99.1556053"
Preescolar,KNOWLEDGE ROAD SCHOOL,MATUTINO,AV. MEXICO AJUSCO NO. 500,SAN MIGUEL XICALCO,TLALPAN,Particular,"AV. MEXICO AJUSCO NO. 500, SAN MIGUEL XICALCO, TLALPAN",19.234489,-99.1725717,"19.234489,-99.1725717"
Preescolar,HUMANITREE NEST,MATUTINO,"PASEO DE LA REFORMA NOS. 930, 940,9",LOMAS DE CHAPULTEPEC,MIGUEL HIDALGO,Particular,"PASEO DE LA REFORMA NOS. 930, 940,9, LOMAS DE CHAPULTEPEC, MIGUEL HIDALGO",19.424051,-99.2117422,"19.424051,-99.2117422"
Preescolar,COLEGIO PEDAGOGICO LONDRES,MATUTINO,GRACIANO SÁNCHEZ MZ. 172LT. 12,SANTA MARTHA ACATITLA,IZTAPALAPA,Particular,"GRACIANO SÁNCHEZ MZ. 172LT. 12, SANTA MARTHA ACATITLA, IZTAPALAPA",19.3769523,-99.0117721,"19.3769523,-99.0117721"
Preescolar,COLEGIO LAS AMERICAS II,MATUTINO,GANADEROS NO. 251,VALLE DEL SUR,IZTAPALAPA,Particular,"GANADEROS NO. 251, VALLE DEL SUR, IZTAPALAPA",19.3500077,-99.1141492,"19.3500077,-99.1141492"
Preescolar,COLEGIO CALTIA  A.C.,MATUTINO,CANAL DE SAN JUAN NO. 71,AGRICOLA ORIENTAL,IZTACALCO,Particular,"CANAL DE SAN JUAN NO. 71, AGRICOLA ORIENTAL, IZTACALCO",19.3953482,-99.0589648,"19.3953482,-99.0589648"
Preescolar,CENTRO DE DESARROLLO INFANTIL MONTESSORI EL PAPALOTE,MATUTINO,BENJAMIN TUDELA MZA. 31 LT. 14,LOMAS DE CAPULA,ALVARO OBREGON,Particular,"BENJAMIN TUDELA MZA. 31 LT. 14, LOMAS DE CAPULA, ALVARO OBREGON",19.3801563,-99.214171,"19.3801563,-99.214171"
Preescolar,KINDER CEDROS DEL VALLE,MATUTINO,LOPEZ COTILLA NO. 1807,DEL VALLE,BENITO JUAREZ,Particular,"LOPEZ COTILLA NO. 1807, DEL VALLE, BENITO JUAREZ",19.3642204,-99.1705794,"19.3642204,-99.1705794"
Preescolar,IMPULSO PEDAGÓGICO MEXICANO,MATUTINO,VITO ALESSIO ROBLES NO. 45,HACIENDA DE GUADALUPE CHIMALISTAC,ALVARO OBREGON,Particular,"VITO ALESSIO ROBLES NO. 45, HACIENDA DE GUADALUPE CHIMALISTAC, ALVARO OBREGON",19.3506714,-99.1848513,"19.3506714,-99.1848513"
Preescolar,KALI COMARU,MATUTINO,LAGO MAYOR NO. 43,PENSIL,MIGUEL HIDALGO,Particular,"LAGO MAYOR NO. 43, PENSIL, MIGUEL HIDALGO",19.4485259,-99.1857399,"19.4485259,-99.1857399"
Preescolar,COLEGIO BEQUER,MATUTINO,PONIENTE 9 NO 12,CUCHILLA DEL TESORO,GUSTAVO A. MADERO,Particular,"PONIENTE 9 NO 12, CUCHILLA DEL TESORO, GUSTAVO A. MADERO",19.4478366,-99.0621409,"19.4478366,-99.0621409"
Preescolar,CENTRO EDUCATIVO HANNIA,MATUTINO,NORTE 13 NO 172,MOCTEZUMA 2A SECCION,VENUSTIANO CARRANZA,Particular,"NORTE 13 NO 172, MOCTEZUMA 2A SECCION, VENUSTIANO CARRANZA",19.4290699,-99.1002785,"19.4290699,-99.1002785"
Preescolar,UN MUNDO FANTASTICO,MATUTINO,NOVELISTAS NO. 24,NUEVA ROSITA,IZTAPALAPA,Particular,"NOVELISTAS NO. 24, NUEVA ROSITA, IZTAPALAPA",19.3801625,-99.1085721,"19.3801625,-99.1085721"
Preescolar,COLEGIO BILINGÜE SAINT MARY,MATUTINO,JAIME TORRES BODET NO 75,SANTA MARIA LA RIBERA,CUAUHTEMOC,Particular,"JAIME TORRES BODET NO 75, SANTA MARIA LA RIBERA, CUAUHTEMOC",19.4448527,-99.1585197,"19.4448527,-99.1585197"
Preescolar,CENTRO DE DESARROLLO EDUCATIVO ATENEA,MATUTINO,CARLOS SANTANA NO 78,MOCTEZUMA 1A SECCION,VENUSTIANO CARRANZA,Particular,"CARLOS SANTANA NO 78, MOCTEZUMA 1A SECCION, VENUSTIANO CARRANZA",19.4305389,-99.107507,"19.4305389,-99.107507"
Preescolar,INSTITUTO PARYLUZ,MATUTINO,CAMPO MINATITLAN NO 28,REYNOSA TAMAULIPAS,AZCAPOTZALCO,Particular,"CAMPO MINATITLAN NO 28, REYNOSA TAMAULIPAS, AZCAPOTZALCO",,,
Preescolar,LEARNING PLAYHOUSE,MATUTINO,AVENIDA OLIVAR DE LOS PADRES NO 1171,OLIVAR DE LOS PADRES,ALVARO OBREGON,Particular,"AVENIDA OLIVAR DE LOS PADRES NO 1171, OLIVAR DE LOS PADRES, ALVARO OBREGON",19.3341864,-99.2309526,"19.3341864,-99.2309526"
Preescolar,OR SAMEAJ,MATUTINO,PALO ALTO NO. 42,LOMAS DE PALO ALTO,CUAJIMALPA DE MORELOS,Particular,"PALO ALTO NO. 42, LOMAS DE PALO ALTO, CUAJIMALPA DE MORELOS",19.3822082,-99.2562057,"19.3822082,-99.2562057"
Preescolar,KINDER BAILEY,MATUTINO,COAHUILA NO 50,LA GUADALUPE,LA MAGDALENA CONTRERAS,Particular,"COAHUILA NO 50, LA GUADALUPE, LA MAGDALENA CONTRERAS",19.3085657,-99.2305483,"19.3085657,-99.2305483"
Preescolar,INSTITUTO ENRIQUETA CASTELLTORT,MATUTINO,CUAUHTEMOC 120,ARAGON,GUSTAVO A. MADERO,Particular,"CUAUHTEMOC 120, ARAGON, GUSTAVO A. MADERO",19.48336,-99.1091815,"19.48336,-99.1091815"
Preescolar,INSTITUTO CARL SAGAN,MATUTINO,AV. DE LAS MINAS MZ. 159 LT. 8 ZN. 5,TENORIOS,IZTAPALAPA,Particular,"AV. DE LAS MINAS MZ. 159 LT. 8 ZN. 5, TENORIOS, IZTAPALAPA",19.3220613,-99.018896,"19.3220613,-99.018896"
Preescolar,SUNNY HILL LEARNING CENTER,MATUTINO,TLALOC NO 1 PROV. FRACION ORIENTE,CONTADERO,CUAJIMALPA DE MORELOS,Particular,"TLALOC NO 1 PROV. FRACION ORIENTE, CONTADERO, CUAJIMALPA DE MORELOS",19.3465528,-99.2978991,"19.3465528,-99.2978991"
Preescolar,FRANCESCO TONUCCI,MATUTINO,BATALLA DE SILAO 3A. SECC. MZ. 78 LT. 797 D,LEYES DE REFORMA,IZTAPALAPA,Particular,"BATALLA DE SILAO 3A. SECC. MZ. 78 LT. 797 D, LEYES DE REFORMA, IZTAPALAPA",19.3748918,-99.0730049,"19.3748918,-99.0730049"
Preescolar,INSTITUTO LUDENS,MATUTINO,ECONOMISTA NO. 9,SAN JUANICO MEXTIPAC,IZTAPALAPA,Particular,"ECONOMISTA NO. 9, SAN JUANICO MEXTIPAC, IZTAPALAPA",19.3745529,-99.1209282,"19.3745529,-99.1209282"
Preescolar,JARDÍN DE NIÑOS LA SEMILLITA DE MARÍA,MATUTINO,CAUDILLO DEL SUR MANZANA 21 LOTE 7,EMILIANO ZAPATA,COYOACAN,Particular,"CAUDILLO DEL SUR MANZANA 21 LOTE 7, EMILIANO ZAPATA, COYOACAN",19.3161605,-99.1113977,"19.3161605,-99.1113977"
Preescolar,BRIDGEWAY NORTH AMERICAN SCHOOL,MATUTINO,CARRILLO PUERTO NO. 334 Y GENERAL MANUEL RINCON NO.45,GENERAL PEDRO MARIA ANAYA,BENITO JUAREZ,Particular,"CARRILLO PUERTO NO. 334 Y GENERAL MANUEL RINCON NO.45, GENERAL PEDRO MARIA ANAYA, BENITO JUAREZ",19.3616408,-99.1607174,"19.3616408,-99.1607174"
Preescolar,JASELU,MATUTINO,MONTES URALES NO 772,LOMAS DE CHAPULTEPEC,MIGUEL HIDALGO,Particular,"MONTES URALES NO 772, LOMAS DE CHAPULTEPEC, MIGUEL HIDALGO",19.4237861,-99.2043999,"19.4237861,-99.2043999"
Preescolar,SANTACRUZ,MATUTINO,5 DE FEBRERO NO 614,ALAMOS,BENITO JUAREZ,Particular,"5 DE FEBRERO NO 614, ALAMOS, BENITO JUAREZ",19.399693,-99.138716,"19.399693,-99.138716"
Preescolar,COLEGIO VALDELUZ,MATUTINO,PALMIRA MZA. 135 LOTE 4,CASTILLO GRANDE,GUSTAVO A. MADERO,Particular,"PALMIRA MZA. 135 LOTE 4, CASTILLO GRANDE, GUSTAVO A. MADERO",19.5282478,-99.1020679,"19.5282478,-99.1020679"
Preescolar,COLEGIO PIONEROS DEL SABER,MATUTINO,CAMINO VIEJO A SAN PEDRO MARTIR NO. 37 INTERIOR 4,CHIMALCOYOTL,TLALPAN,Particular,"CAMINO VIEJO A SAN PEDRO MARTIR NO. 37 INTERIOR 4, CHIMALCOYOTL, TLALPAN",19.2762975,-99.1644597,"19.2762975,-99.1644597"
Preescolar,KUNDALINI-CIAC,MATUTINO,SUR 111 NO. 738,SECTOR POPULAR,IZTAPALAPA,Particular,"SUR 111 NO. 738, SECTOR POPULAR, IZTAPALAPA",19.3687758,-99.1148451,"19.3687758,-99.1148451"
Preescolar,JARDIN DE NIÑOS CAMPANITA,MATUTINO,ORIENTE 87 NO. 2729,EMILIANO ZAPATA,GUSTAVO A. MADERO,Particular,"ORIENTE 87 NO. 2729, EMILIANO ZAPATA, GUSTAVO A. MADERO",19.4600303,-99.1167412,"19.4600303,-99.1167412"
Preescolar,KINDERGARDEN GRECIA,MATUTINO,JOSÉ MARÍA RODRÍGUEZ NO. 41,CONSTITUCION 1917,IZTAPALAPA,Particular,"JOSÉ MARÍA RODRÍGUEZ NO. 41, CONSTITUCION 1917, IZTAPALAPA",19.3473746,-99.0623532,"19.3473746,-99.0623532"
Preescolar,LICEO INTEGRAL DE FOMENTO EDUCATIVO (LIFE),MATUTINO,LUIS CARRACCI NO. 22,SAN JUAN,BENITO JUAREZ,Particular,"LUIS CARRACCI NO. 22, SAN JUAN, BENITO JUAREZ",19.3766923,-99.1850432,"19.3766923,-99.1850432"
Preescolar,COLEGIO CAMELOT,MATUTINO,ANSELMO DE LA PORTILLA NO. 52,JARDIN BALBUENA,VENUSTIANO CARRANZA,Particular,"ANSELMO DE LA PORTILLA NO. 52, JARDIN BALBUENA, VENUSTIANO CARRANZA",19.421125,-99.102802,"19.421125,-99.102802"
Preescolar,DON LUIS GUANELLA,MATUTINO,RÍO LERMA No. 27,SAN MIGUEL TEOTONGO,IZTAPALAPA,Particular,"RÍO LERMA No. 27, SAN MIGUEL TEOTONGO, IZTAPALAPA",19.3434287,-98.9880319,"19.3434287,-98.9880319"
Preescolar,BABY DURKHEIM ANZURES,MATUTINO,BÉCQUER NO. 43,ANZURES,MIGUEL HIDALGO,Particular,"BÉCQUER NO. 43, ANZURES, MIGUEL HIDALGO",19.4338384,-99.1754539,"19.4338384,-99.1754539"
Preescolar,EL MUNDO DE DALÍ,MATUTINO,TORIBIO ORTEGA MANZANA 14 LOTE 1,FRANCISCO VILLA,IZTAPALAPA,Particular,"TORIBIO ORTEGA MANZANA 14 LOTE 1, FRANCISCO VILLA, IZTAPALAPA",19.3390762,-99.0591044,"19.3390762,-99.0591044"
Preescolar,LISASI TEPEPAN,MATUTINO,AVENIDA 16 DE SEPTIEMBRE NO 36,SANTA MARIA TEPEPAN,XOCHIMILCO,Particular,"AVENIDA 16 DE SEPTIEMBRE NO 36, SANTA MARIA TEPEPAN, XOCHIMILCO",19.2748426,-99.1326376,"19.2748426,-99.1326376"
Preescolar,COLEGIO LADESIDE,MATUTINO,LAGUNA DE YURIRIA NO 55,GRANADA,MIGUEL HIDALGO,Particular,"LAGUNA DE YURIRIA NO 55, GRANADA, MIGUEL HIDALGO",19.4416995,-99.1928627,"19.4416995,-99.1928627"
Primaria,COLEGIO SOR JUANA INES DE LA CRUZ,MATUTINO,ATANASIO SARABIA S/N,SANTA MARTHA ACATITLA,IZTAPALAPA,Particular,"ATANASIO SARABIA S/N, SANTA MARTHA ACATITLA, IZTAPALAPA",19.3600933,-99.0037343,"19.3600933,-99.0037343"
Primaria,AMERICA,MATUTINO,MAR EGEO NO. 243,POPOTLA,MIGUEL HIDALGO,Particular,"MAR EGEO NO. 243, POPOTLA, MIGUEL HIDALGO",19.4578641,-99.1785601,"19.4578641,-99.1785601"
Primaria,CRUZ GOMEZ TAGLE,MATUTINO,SAN ANTONIO TOMATLAN No. 72,MORELOS,VENUSTIANO CARRANZA,Particular,"SAN ANTONIO TOMATLAN No. 72, MORELOS, VENUSTIANO CARRANZA",19.4355086,-99.1225478,"19.4355086,-99.1225478"
Primaria,COLEGIO DE SAN IGNACIO DE LOYOLA (VIZCAINAS) INSTITUCION DE ASISTENCIA PRIVADA,MATUTINO,VIZCAINAS NO 21,CENTRO,CUAUHTEMOC,Particular,"VIZCAINAS NO 21, CENTRO, CUAUHTEMOC",19.4288347,-99.1404486,"19.4288347,-99.1404486"
Primaria,RENACIMIENTO,MATUTINO,ORIZABA 136,ROMA NORTE,CUAUHTEMOC,Particular,"ORIZABA 136, ROMA NORTE, CUAUHTEMOC",19.4171268,-99.1592961,"19.4171268,-99.1592961"
Primaria,NIÑO DOMINGO SAVIO,MATUTINO,GENERAL ARISTA NO. 96,ARGENTINA PONIENTE,MIGUEL HIDALGO,Particular,"GENERAL ARISTA NO. 96, ARGENTINA PONIENTE, MIGUEL HIDALGO",19.4589885,-99.2108665,"19.4589885,-99.2108665"
Primaria,INSTITUTO ANGLO ESPAÑOL,MATUTINO,SADI CARNOT 44,SAN RAFAEL,CUAUHTEMOC,Particular,"SADI CARNOT 44, SAN RAFAEL, CUAUHTEMOC",19.437364,-99.1576927,"19.437364,-99.1576927"
Primaria,INSTITUTO CULTURAL FRANCES,MATUTINO,FERNANDO CELADA NO. 12,PERIODISTA,MIGUEL HIDALGO,Particular,"FERNANDO CELADA NO. 12, PERIODISTA, MIGUEL HIDALGO",19.4468054,-99.2194987,"19.4468054,-99.2194987"
Primaria,ISABEL GRASSETEAU,MATUTINO,JAIME TORRES BODET 166,SANTA MARIA LA RIBERA,CUAUHTEMOC,Particular,"JAIME TORRES BODET 166, SANTA MARIA LA RIBERA, CUAUHTEMOC",19.4498038,-99.1576234,"19.4498038,-99.1576234"
Primaria,HISPANO AMERICANO,MATUTINO,DR. ATL No 199,SANTA MARIA LA RIBERA,CUAUHTEMOC,Particular,"DR. ATL No 199, SANTA MARIA LA RIBERA, CUAUHTEMOC",19.4494664,-99.1560783,"19.4494664,-99.1560783"
Primaria,REINA MARIA,MATUTINO,RIO EUFRATES # 15,CUAUHTEMOC,CUAUHTEMOC,Particular,"RIO EUFRATES # 15, CUAUHTEMOC, CUAUHTEMOC",19.433177,-99.1667408,"19.433177,-99.1667408"
Primaria,AMADO NERVO,MATUTINO,BAJIO NO. 307,ROMA SUR,CUAUHTEMOC,Particular,"BAJIO NO. 307, ROMA SUR, CUAUHTEMOC",19.4029933,-99.1678504,"19.4029933,-99.1678504"
Primaria,AMERICA UNIDA,MATUTINO,CARLOS SANTANA No. 68,MOCTEZUMA 1A SECCION,VENUSTIANO CARRANZA,Particular,"CARLOS SANTANA No. 68, MOCTEZUMA 1A SECCION, VENUSTIANO CARRANZA",19.430168,-99.107768,"19.430168,-99.107768"
Primaria,COLEGIO BRITANICO,MATUTINO,ALABAMA NUM 224,NAPOLES,BENITO JUAREZ,Particular,"ALABAMA NUM 224, NAPOLES, BENITO JUAREZ",19.3887754,-99.1809185,"19.3887754,-99.1809185"
Primaria,SEBASTIAN DE APARICIO,MATUTINO,PABLO VERONES 112,ALFONSO XIII,ALVARO OBREGON,Particular,"PABLO VERONES 112, ALFONSO XIII, ALVARO OBREGON",19.3778132,-99.1973686,"19.3778132,-99.1973686"
Primaria,SIMON BOLIVAR,MATUTINO,GALICIA 8,INSURGENTES MIXCOAC,BENITO JUAREZ,Particular,"GALICIA 8, INSURGENTES MIXCOAC, BENITO JUAREZ",19.3710464,-99.183026,"19.3710464,-99.183026"
Primaria,INSTITUTO CUMBRES LOMAS,MATUTINO,ROSEDAL 50,LOMAS DE CHAPULTEPEC,MIGUEL HIDALGO,Particular,"ROSEDAL 50, LOMAS DE CHAPULTEPEC, MIGUEL HIDALGO",19.4317167,-99.2138201,"19.4317167,-99.2138201"
Primaria,COLEGIO PETERSON,MATUTINO,HUIZACHITO NO.80,LOMAS DE VISTA HERMOSA,CUAJIMALPA DE MORELOS,Particular,"HUIZACHITO NO.80, LOMAS DE VISTA HERMOSA, CUAJIMALPA DE MORELOS",19.3706978,-99.2806373,"19.3706978,-99.2806373"
Primaria,COLEGIO ANDERSEN,MATUTINO,MONTE ALBAN NO 233,NARVARTE,BENITO JUAREZ,Particular,"MONTE ALBAN NO 233, NARVARTE, BENITO JUAREZ",19.3893815,-99.1506529,"19.3893815,-99.1506529"
Primaria,JOSÉ JOAQUIN FERNANDEZ DE LIZARDI,MATUTINO,PRESA SANTA TERESA NUM 170,IRRIGACION,MIGUEL HIDALGO,Particular,"PRESA SANTA TERESA NUM 170, IRRIGACION, MIGUEL HIDALGO",19.4442729,-99.2057197,"19.4442729,-99.2057197"
Primaria,COLEGIO SUIZO DE MÉXICO,MATUTINO,NICOLAS SAN JUAN NUM 917,DEL VALLE,BENITO JUAREZ,Particular,"NICOLAS SAN JUAN NUM 917, DEL VALLE, BENITO JUAREZ",19.3856489,-99.1630429,"19.3856489,-99.1630429"
Primaria,COLEGIO ISRAELITA DE MÉXICO,MATUTINO,LOMA DEL RECUERDO 44.,LOMAS DE VISTA HERMOSA,CUAJIMALPA DE MORELOS,Particular,"LOMA DEL RECUERDO 44., LOMAS DE VISTA HERMOSA, CUAJIMALPA DE MORELOS",19.3796757,-99.2699458,"19.3796757,-99.2699458"
Primaria,INSTITUTO MÉXICO,MATUTINO,AMORES 1317,DEL VALLE,BENITO JUAREZ,Particular,"AMORES 1317, DEL VALLE, BENITO JUAREZ",19.3754461,-99.1686438,"19.3754461,-99.1686438"
Primaria,ESCUELA ACTIVA,MATUTINO,EMILIO CARRANZA NO. 359,SAN ANDRES TETEPILCO,IZTAPALAPA,Particular,"EMILIO CARRANZA NO. 359, SAN ANDRES TETEPILCO, IZTAPALAPA",19.3707638,-99.1280742,"19.3707638,-99.1280742"
Primaria,MARIA REGINA SANCHEZ MUÑOZ,MATUTINO,AV. ENCARNACION ORTIZ NO.1842,COSMOPOLITA AMPLIACION,AZCAPOTZALCO,Particular,"AV. ENCARNACION ORTIZ NO.1842, COSMOPOLITA AMPLIACION, AZCAPOTZALCO",19.471635,-99.1604726,"19.471635,-99.1604726"
Primaria,COLEGIO NICOLAS BRAVO,MATUTINO,AV. 5 DE MAYO NO. 162,SAN LUCAS,IZTAPALAPA,Particular,"AV. 5 DE MAYO NO. 162, SAN LUCAS, IZTAPALAPA",19.3620344,-99.0971593,"19.3620344,-99.0971593"
Primaria,INSTITUTO MONTESSORI,MATUTINO,PROL. EMILIANO ZAPATA NO. 65,UNIDAD MODELO,IZTAPALAPA,Particular,"PROL. EMILIANO ZAPATA NO. 65, UNIDAD MODELO, IZTAPALAPA",19.362145,-99.1252677,"19.362145,-99.1252677"
Primaria,CRISTIANA FERNANDEZ DE MERINO,MATUTINO,TRIPOLI No. 112,PORTALES,BENITO JUAREZ,Particular,"TRIPOLI No. 112, PORTALES, BENITO JUAREZ",19.3728189,-99.1532042,"19.3728189,-99.1532042"
Primaria,CONSUELO,MATUTINO,CONSUELO NO. 8,SANTA MARTHA ACATITLA,IZTAPALAPA,Particular,"CONSUELO NO. 8, SANTA MARTHA ACATITLA, IZTAPALAPA",19.3591521,-99.0047991,"19.3591521,-99.0047991"
Primaria,COLEGIO MARGARITA GALINDO DE RUIZ,MATUTINO,PUERTO ZIHUATANEJO NO 46,CASAS ALEMAN AMPLIACION,GUSTAVO A. MADERO,Particular,"PUERTO ZIHUATANEJO NO 46, CASAS ALEMAN AMPLIACION, GUSTAVO A. MADERO",19.4764848,-99.0870945,"19.4764848,-99.0870945"
Primaria,LONDRES,MATUTINO,MARTIN CARRERA NO 155,MARTIN CARRERA,GUSTAVO A. MADERO,Particular,"MARTIN CARRERA NO 155, MARTIN CARRERA, GUSTAVO A. MADERO",19.4887272,-99.1059518,"19.4887272,-99.1059518"
Primaria,"""COLEGIO MÉXICO""",MATUTINO,NORTE 86-A NO 6538,SAN PEDRO EL CHICO,GUSTAVO A. MADERO,Particular,"NORTE 86-A NO 6538, SAN PEDRO EL CHICO, GUSTAVO A. MADERO",19.4701212,-99.0975916,"19.4701212,-99.0975916"
Primaria,LAS ROSAS,MATUTINO,GARRIDO NO 123,ARAGON,GUSTAVO A. MADERO,Particular,"GARRIDO NO 123, ARAGON, GUSTAVO A. MADERO",19.4821501,-99.1157294,"19.4821501,-99.1157294"
Primaria,LA UNIDAD,MATUTINO,PUERTO COZUMEL NUM 20,CASAS ALEMAN,GUSTAVO A. MADERO,Particular,"PUERTO COZUMEL NUM 20, CASAS ALEMAN, GUSTAVO A. MADERO",19.4757822,-99.0881271,"19.4757822,-99.0881271"
Primaria,CONCEPCION PASCAL CRUZADO,MATUTINO,SALONICA NO 73,CLAVERIA,AZCAPOTZALCO,Particular,"SALONICA NO 73, CLAVERIA, AZCAPOTZALCO",19.4695466,-99.182183,"19.4695466,-99.182183"
Primaria,INSTITUTO ATENIENSE,MATUTINO,ELSA NO 7,GUADALUPE TEPEYAC,GUSTAVO A. MADERO,Particular,"ELSA NO 7, GUADALUPE TEPEYAC, GUSTAVO A. MADERO",19.4638744,-99.1223339,"19.4638744,-99.1223339"
Primaria,ZACATECAS,MATUTINO,GENERAL SANTA ANA NO. 155,MARTIN CARRERA,GUSTAVO A. MADERO,Particular,"GENERAL SANTA ANA NO. 155, MARTIN CARRERA, GUSTAVO A. MADERO",19.4876546,-99.1065073,"19.4876546,-99.1065073"
Primaria,FRAY GARCÍA DE CISNEROS,MATUTINO,INSURGENTES NORTE NO 1590,LINDAVISTA,GUSTAVO A. MADERO,Particular,"INSURGENTES NORTE NO 1590, LINDAVISTA, GUSTAVO A. MADERO",19.4889234,-99.1236956,"19.4889234,-99.1236956"
Primaria,TEPEYAC ESTRELLA,MATUTINO,VENTURINA NO 75,ESTRELLA,GUSTAVO A. MADERO,Particular,"VENTURINA NO 75, ESTRELLA, GUSTAVO A. MADERO",19.4752626,-99.1138186,"19.4752626,-99.1138186"
Primaria,VICTORIA TEPEYAC,MATUTINO,MATANZAS NO 798,LINDAVISTA,GUSTAVO A. MADERO,Particular,"MATANZAS NO 798, LINDAVISTA, GUSTAVO A. MADERO",19.4937505,-99.1300792,"19.4937505,-99.1300792"
Primaria,CULTURA Y PATRIA,MATUTINO,CALZ. DE LOS MISTERIOS NUM 751,TEPEYAC INSURGENTES,GUSTAVO A. MADERO,Particular,"CALZ. DE LOS MISTERIOS NUM 751, TEPEYAC INSURGENTES, GUSTAVO A. MADERO",19.4811386,-99.1199565,"19.4811386,-99.1199565"
Primaria,INSTITUTO BILINGUE LIBERTAD,MATUTINO,MAR MEDITERRANEO 175,POPOTLA,MIGUEL HIDALGO,Particular,"MAR MEDITERRANEO 175, POPOTLA, MIGUEL HIDALGO",19.4561136,-99.1781275,"19.4561136,-99.1781275"
Primaria,INSTITUTO OVALLE MONDAY,MATUTINO,LATACUNGA NO 802,LINDAVISTA,GUSTAVO A. MADERO,Particular,"LATACUNGA NO 802, LINDAVISTA, GUSTAVO A. MADERO",19.4919935,-99.1272052,"19.4919935,-99.1272052"
Primaria,MARIA CURIE,MATUTINO,FRANCISCO MORENO NO. 136,GUSTAVO A. MADERO,GUSTAVO A. MADERO,Particular,"FRANCISCO MORENO NO. 136, GUSTAVO A. MADERO, GUSTAVO A. MADERO",19.4822041,-99.1114252,"19.4822041,-99.1114252"
Primaria,INSTITUTO NOTTINGHAM,MATUTINO,AV 553 NO 75,SAN JUAN DE ARAGON,GUSTAVO A. MADERO,Particular,"AV 553 NO 75, SAN JUAN DE ARAGON, GUSTAVO A. MADERO",19.4508074,-99.0861532,"19.4508074,-99.0861532"
Primaria,CENTRO EDUCATIVO AMARU,MATUTINO,MORELOS NO 37  Y39,AZCAPOTZALCO,AZCAPOTZALCO,Particular,"MORELOS NO 37  Y39, AZCAPOTZALCO, AZCAPOTZALCO",19.4800639,-99.1852016,"19.4800639,-99.1852016"
Primaria,INSTITUTO MORELOS,MATUTINO,CALZ. MEXICO TACUBA #724,TACUBA,MIGUEL HIDALGO,Particular,"CALZ. MEXICO TACUBA #724, TACUBA, MIGUEL HIDALGO",19.4586468,-99.1855558,"19.4586468,-99.1855558"
Primaria,COLEGIO HEBREO TARBUT,MATUTINO,AV. LOMA DEL PARQUE NO. 216,LOMAS DE VISTA HERMOSA,CUAJIMALPA DE MORELOS,Particular,"AV. LOMA DEL PARQUE NO. 216, LOMAS DE VISTA HERMOSA, CUAJIMALPA DE MORELOS",19.3722023,-99.2769383,"19.3722023,-99.2769383"
Primaria,COLEGIO ROSSLAND,MATUTINO,13 DE SEPTIEMBRE NO. 18,ESCANDON,MIGUEL HIDALGO,Particular,"13 DE SEPTIEMBRE NO. 18, ESCANDON, MIGUEL HIDALGO",19.3988137,-99.1826855,"19.3988137,-99.1826855"
Primaria,LUIS VIVES,MATUTINO,CARLOS B. ZETINA 45,ESCANDON,MIGUEL HIDALGO,Particular,"CARLOS B. ZETINA 45, ESCANDON, MIGUEL HIDALGO",19.4065118,-99.1826973,"19.4065118,-99.1826973"
Primaria,INSTITUTO HISPANO INGLES DE MÉXICO,MATUTINO,GENERAL CANO 153,SAN MIGUEL CHAPULTEPEC,MIGUEL HIDALGO,Particular,"GENERAL CANO 153, SAN MIGUEL CHAPULTEPEC, MIGUEL HIDALGO",19.4085888,-99.1859242,"19.4085888,-99.1859242"
Primaria,FEDERICO SALVADOR,MATUTINO,SATURNINO HERRAN 49,SAN JOSE INSURGENTES,BENITO JUAREZ,Particular,"SATURNINO HERRAN 49, SAN JOSE INSURGENTES, BENITO JUAREZ",19.3684362,-99.1866605,"19.3684362,-99.1866605"
Primaria,TABASCO,MATUTINO,NATTIER 2,SAN JUAN,BENITO JUAREZ,Particular,"NATTIER 2, SAN JUAN, BENITO JUAREZ",19.3788635,-99.1836988,"19.3788635,-99.1836988"
Primaria,MARIA EUGENIA MILLERET,MATUTINO,AV. JOHN F. KENNEDY S/N,ISIDRO FABELA,TLALPAN,Particular,"AV. JOHN F. KENNEDY S/N, ISIDRO FABELA, TLALPAN",19.2985259,-99.174689,"19.2985259,-99.174689"
Primaria,PABLO MARIA GUZMÁN,MATUTINO,AVENIDA SAN BERNABE NO 276,SAN JERONIMO LIDICE,LA MAGDALENA CONTRERAS,Particular,"AVENIDA SAN BERNABE NO 276, SAN JERONIMO LIDICE, LA MAGDALENA CONTRERAS",19.331664,-99.2240373,"19.331664,-99.2240373"
Primaria,REINA ISABEL,MATUTINO,CONDOR NO 198,ALPES,ALVARO OBREGON,Particular,"CONDOR NO 198, ALPES, ALVARO OBREGON",19.3608547,-99.1956852,"19.3608547,-99.1956852"
Primaria,LESTONNAC,MATUTINO,CAFETALES NUM 140,RINCONADA COAPA,TLALPAN,Particular,"CAFETALES NUM 140, RINCONADA COAPA, TLALPAN",19.2958062,-99.1142602,"19.2958062,-99.1142602"
Primaria,INSTITUTO ASUNCION DE MÉXICO,MATUTINO,CALZADA DE LAS AGUILAS 219,LAS AGUILAS,ALVARO OBREGON,Particular,"CALZADA DE LAS AGUILAS 219, LAS AGUILAS, ALVARO OBREGON",19.3600114,-99.1985152,"19.3600114,-99.1985152"
Primaria,ACADEMIA MODERNA,MATUTINO,AMERICA No. 184,PARQUE SAN ANDRES,COYOACAN,Particular,"AMERICA No. 184, PARQUE SAN ANDRES, COYOACAN",19.3444903,-99.1525853,"19.3444903,-99.1525853"
Primaria,INSTITUTO CULTURAL,MATUTINO,MIGUEL ANGEL DE QUEVEDO No. 1190,PARQUE SAN ANDRES,COYOACAN,Particular,"MIGUEL ANGEL DE QUEVEDO No. 1190, PARQUE SAN ANDRES, COYOACAN",19.3425643,-99.1455735,"19.3425643,-99.1455735"
Primaria,INSTITUTO JUÁREZ,MATUTINO,CUAUHTEMOC No. 99,DEL CARMEN,COYOACAN,Particular,"CUAUHTEMOC No. 99, DEL CARMEN, COYOACAN",19.3519347,-99.1611398,"19.3519347,-99.1611398"
Primaria,ANTONIO JOSÉ DE SUCRE,MATUTINO,CERRO DE JESUS No. 140,CAMPESTRE CHURUBUSCO,COYOACAN,Particular,"CERRO DE JESUS No. 140, CAMPESTRE CHURUBUSCO, COYOACAN",19.3443424,-99.1358413,"19.3443424,-99.1358413"
Primaria,ESPIRITU DE MÉXICO,MATUTINO,XOMPOL NO 51,SAN MATEO XALPA,XOCHIMILCO,Particular,"XOMPOL NO 51, SAN MATEO XALPA, XOCHIMILCO",19.2088639,-99.1266032,"19.2088639,-99.1266032"
Primaria,HERNAN CORTES,MATUTINO,HIDALGO NUM 2,TLALPAN,TLALPAN,Particular,"HIDALGO NUM 2, TLALPAN, TLALPAN",19.289414,-99.1681249,"19.289414,-99.1681249"
Primaria,"""CENTRO EDUCATIVO JEAN PIAGET""",MATUTINO,AVENIDA PATRIOTISMO NO 757 POUSSINI NO 70 Y RUBENS NO 39,SAN JUAN,BENITO JUAREZ,Particular,"AVENIDA PATRIOTISMO NO 757 POUSSINI NO 70 Y RUBENS NO 39, SAN JUAN, BENITO JUAREZ",19.3780081,-99.185341,"19.3780081,-99.185341"
Primaria,FLORENCIA NIGHTINGALE,MATUTINO,AV LINDAVISTA NO. 170,LINDAVISTA,GUSTAVO A. MADERO,Particular,"AV LINDAVISTA NO. 170, LINDAVISTA, GUSTAVO A. MADERO",19.4915153,-99.1250824,"19.4915153,-99.1250824"
Primaria,COLEGIO MERICI,MATUTINO,LAS GRANJAS NO 45,PALO ALTO,CUAJIMALPA DE MORELOS,Particular,"LAS GRANJAS NO 45, PALO ALTO, CUAJIMALPA DE MORELOS",19.3831071,-99.2552818,"19.3831071,-99.2552818"
Primaria,LICEO MEXICANO,MATUTINO,CORDOBA 167,ROMA NORTE,CUAUHTEMOC,Particular,"CORDOBA 167, ROMA NORTE, CUAUHTEMOC",19.4156165,-99.1580477,"19.4156165,-99.1580477"
Primaria,TRABAJADORES DEL CAMPO,MATUTINO,AURELIO RUELAS NUM 43,MIGUEL HIDALGO,TLALPAN,Particular,"AURELIO RUELAS NUM 43, MIGUEL HIDALGO, TLALPAN",19.2879321,-99.1644052,"19.2879321,-99.1644052"
Primaria,CENTRO ESCOLAR MORELOS,MATUTINO,AV. MORELOS No. 665,MAGDALENA MIXHUCA,VENUSTIANO CARRANZA,Particular,"AV. MORELOS No. 665, MAGDALENA MIXHUCA, VENUSTIANO CARRANZA",19.4081409,-99.1090642,"19.4081409,-99.1090642"
Primaria,FERNANDO DE ALVA,MATUTINO,PURISIMA 10-BIS,SANTA MARIA TOMATLAN,IZTAPALAPA,Particular,"PURISIMA 10-BIS, SANTA MARIA TOMATLAN, IZTAPALAPA",19.3228109,-99.0993247,"19.3228109,-99.0993247"
Primaria,LICEO MEXICANO JAPONES,MATUTINO,CAMINO SANTA TERESA NO 1500,JARDINES DEL PEDREGAL,ALVARO OBREGON,Particular,"CAMINO SANTA TERESA NO 1500, JARDINES DEL PEDREGAL, ALVARO OBREGON",19.3090831,-99.2117564,"19.3090831,-99.2117564"
