NIVEL,NOMBRE,TURNO,DOMICILIO,COLONIA,ALCALDÍA,SOSTENIMIENTO,ubicacion,lat,lon,coordenadas
Primaria,LIDERES DEL FUTURO,MATUTINO,MANUEL CAPETILLO S/N MZ. 18 LT. 9 ZONA 3,SAN MIGUEL TEOTONGO,IZTAPALAPA,Particular,"MANUEL CAPETILLO S/N MZ. 18 LT. 9 ZONA 3, SAN MIGUEL TEOTONGO, IZTAPALAPA",19.3419762,-98.9870243,"19.3419762,-98.9870243"
Primaria,OXFORD,MATUTINO,NICOLÁS MARTÍNEZ MZ. 10 LT. 11 Y 12,PARAJE SAN JUAN,IZTAPALAPA,Particular,"NICOLÁS MARTÍNEZ MZ. 10 LT. 11 Y 12, PARAJE SAN JUAN, IZTAPALAPA",19.3372055,-99.068858,"19.3372055,-99.068858"
Primaria,CANADIAN MONTESSORI,MATUTINO,CALZ CAMARONES 232,OBRERO POPULAR,AZCAPOTZALCO,Particular,"CALZ CAMARONES 232, OBRERO POPULAR, AZCAPOTZALCO",19.4651737,-99.1734855,"19.4651737,-99.1734855"
Primaria,"""COMPLEJO EDUCATIVO DE DESARROLLO INTEGRAL""",MATUTINO,SALVADOR ORTEGA FLORES No 14,MIGUEL HIDALGO,TLALPAN,Particular,"SALVADOR ORTEGA FLORES No 14, MIGUEL HIDALGO, TLALPAN",19.285786,-99.194094,"19.285786,-99.194094"
Primaria,COLEGIO ALAMILLA AMERICANO,MATUTINO,RICARDO CASTRO NO 5,EX-HIPODROMO DE PERALVILLO,CUAUHTEMOC,Particular,"RICARDO CASTRO NO 5, EX-HIPODROMO DE PERALVILLO, CUAUHTEMOC",19.4601724,-99.1283389,"19.4601724,-99.1283389"
Primaria,COLEGIO EXCEL KIDS LIDERES DEL FUTURO,MATUTINO,CONMUTADOR NUM. 135,SINATEL AMPLIACION,IZTAPALAPA,Particular,"CONMUTADOR NUM. 135, SINATEL AMPLIACION, IZTAPALAPA",19.3681569,-99.1287054,"19.3681569,-99.1287054"
Primaria,COLEGIO LIBERTADORES DE AMERICA,MATUTINO,CALLE 323 NO 605,NUEVA ATZACOALCO,GUSTAVO A. MADERO,Particular,"CALLE 323 NO 605, NUEVA ATZACOALCO, GUSTAVO A. MADERO",19.4983683,-99.0836462,"19.4983683,-99.0836462"
Primaria,COLEGIO KENT CONDESA,MATUTINO,ZAMORA NO. 42,CONDESA,CUAUHTEMOC,Particular,"ZAMORA NO. 42, CONDESA, CUAUHTEMOC",19.4180784,-99.1770131,"19.4180784,-99.1770131"
Primaria,COLEGIO CONSTRUCTIVISTA AGORA,MATUTINO,MONTE EVEREST NO. 725,LOMAS DE CHAPULTEPEC,MIGUEL HIDALGO,Particular,"MONTE EVEREST NO. 725, LOMAS DE CHAPULTEPEC, MIGUEL HIDALGO",19.4183938,-99.2158461,"19.4183938,-99.2158461"
Primaria,CENTRO EDUCATIVO ANGLO HISPANO,MATUTINO,CENTELLA MZ. 5 LT. 48,VALLE DE LUCES,IZTAPALAPA,Particular,"CENTELLA MZ. 5 LT. 48, VALLE DE LUCES, IZTAPALAPA",19.3381594,-99.0993225,"19.3381594,-99.0993225"
Primaria,"""INSTITUTO PEDAGOGICO GISELLE""",MATUTINO,AVENIDA TLAHUAC NUMERO 6121,MIGUEL HIDALGO,TLAHUAC,Particular,"AVENIDA TLAHUAC NUMERO 6121, MIGUEL HIDALGO, TLAHUAC",19.2995254,-99.0440821,"19.2995254,-99.0440821"
Primaria,"""COLEGIO MODERNO WINDSOR""",MATUTINO,AV. PEDRO ENRÍQUEZ UREÑA No. 681,LOS REYES,COYOACAN,Particular,"AV. PEDRO ENRÍQUEZ UREÑA No. 681, LOS REYES, COYOACAN",19.3339076,-99.1525988,"19.3339076,-99.1525988"
Primaria,COLEGIO DIEGO RIVERA,MATUTINO,ROSA REINA No 31,MOLINO DE ROSAS,ALVARO OBREGON,Particular,"ROSA REINA No 31, MOLINO DE ROSAS, ALVARO OBREGON",19.372555,-99.1966763,"19.372555,-99.1966763"
Primaria,"""LICEO IBÉRICO AMERICANO DE COYOACÁN""",MATUTINO,EJIDO DE SANTA MARÍA TICOMÁN No. 17,SAN FRANCISCO CULHUACAN EJIDO,COYOACAN,Particular,"EJIDO DE SANTA MARÍA TICOMÁN No. 17, SAN FRANCISCO CULHUACAN EJIDO, COYOACAN",19.3335462,-99.1292528,"19.3335462,-99.1292528"
Primaria,COLEGIO J M LONDRES,MATUTINO,CANTÓN No. 139,ROMERO RUBIO,VENUSTIANO CARRANZA,Particular,"CANTÓN No. 139, ROMERO RUBIO, VENUSTIANO CARRANZA",19.4456364,-99.0981037,"19.4456364,-99.0981037"
Primaria,CENTRO EDUCATIVO PLAZAMIGOS,MATUTINO,CALZADA DE TLALPAN 793,POSTAL,BENITO JUAREZ,Particular,"CALZADA DE TLALPAN 793, POSTAL, BENITO JUAREZ",19.3913138,-99.1388053,"19.3913138,-99.1388053"
Primaria,"""CENTRO PEDAGÓGICO ANÁHUAC""",MATUTINO,JALTIPA No. 2,PEDREGAL DE SANTO DOMINGO,COYOACAN,Particular,"JALTIPA No. 2, PEDREGAL DE SANTO DOMINGO, COYOACAN",19.3277116,-99.1685861,"19.3277116,-99.1685861"
Primaria,COLEGIO IZTACCIHUATL,MATUTINO,AV. AÑO DE JUAREZ N°97,SAN LUIS TLAXIALTEMALCO,XOCHIMILCO,Particular,"AV. AÑO DE JUAREZ N°97, SAN LUIS TLAXIALTEMALCO, XOCHIMILCO",19.2570201,-99.0395533,"19.2570201,-99.0395533"
Primaria,CENTRO EDUCATIVO WILLIAM WILBERFORCE,MATUTINO,TULE S/N MZ. 7 LT. 2,SAN MIGUEL TEOTONGO,IZTAPALAPA,Particular,"TULE S/N MZ. 7 LT. 2, SAN MIGUEL TEOTONGO, IZTAPALAPA",19.3441221,-98.992536,"19.3441221,-98.992536"
Primaria,"""ESCUELAS INFANTILES CONSTRUYE""",MATUTINO,ANTIGUO CAMINO A CUERNAVACA  NO 8,SAN MIGUEL TOPILEJO,TLALPAN,Particular,"ANTIGUO CAMINO A CUERNAVACA  NO 8, SAN MIGUEL TOPILEJO, TLALPAN",19.1995209,-99.1429136,"19.1995209,-99.1429136"
Primaria,"""ESCUELA INTEGRAL ROMA""",MATUTINO,MIGUEL ANGEL CASTILLO MANZANA 81 LOTE 3,SAN JOSE,TLAHUAC,Particular,"MIGUEL ANGEL CASTILLO MANZANA 81 LOTE 3, SAN JOSE, TLAHUAC",19.2768357,-98.9985514,"19.2768357,-98.9985514"
Primaria,COLEGIO LEONARDO DA VINCI DIVISION PRIMARIA,MATUTINO,2DA. CDA. DE VICENTE GUERRERO No. 11,SANTIAGO TULYEHUALCO,XOCHIMILCO,Particular,"2DA. CDA. DE VICENTE GUERRERO No. 11, SANTIAGO TULYEHUALCO, XOCHIMILCO",19.2501795,-99.0103482,"19.2501795,-99.0103482"
Primaria,LOLINDIR PRIMARIA,MATUTINO,CUAJIMALPA NO 21,MERCED GOMEZ,ALVARO OBREGON,Particular,"CUAJIMALPA NO 21, MERCED GOMEZ, ALVARO OBREGON",19.3656212,-99.20114,"19.3656212,-99.20114"
Primaria,COLEGIO BICENTENARIO,MATUTINO,ERMITA IZTAPALAPA NO. 1873,LOS ANGELES,IZTAPALAPA,Particular,"ERMITA IZTAPALAPA NO. 1873, LOS ANGELES, IZTAPALAPA",19.3495846,-99.0729935,"19.3495846,-99.0729935"
Primaria,COLEGIO HAYDEN S.C.,MATUTINO,JERICO NO. 31,LOS ANGELES APANOAYA,IZTAPALAPA,Particular,"JERICO NO. 31, LOS ANGELES APANOAYA, IZTAPALAPA",19.3411155,-99.0612453,"19.3411155,-99.0612453"
Primaria,"""COLEGIO LOS ANGELES""",MATUTINO,CALLE 307 NO 19 Y 17,UNIDAD HABITACIONAL EL COYOL,GUSTAVO A. MADERO,Particular,"CALLE 307 NO 19 Y 17, UNIDAD HABITACIONAL EL COYOL, GUSTAVO A. MADERO",19.4896468,-99.0911196,"19.4896468,-99.0911196"
Primaria,COLEGIO JUSTO SIERRA,MATUTINO,"TRUENO S/N LT. 9 Y ZN. 01, MZ. 55 LT. 10",SAN MIGUEL TEOTONGO,IZTAPALAPA,Particular,"TRUENO S/N LT. 9 Y ZN. 01, MZ. 55 LT. 10, SAN MIGUEL TEOTONGO, IZTAPALAPA",19.3434287,-98.9880319,"19.3434287,-98.9880319"
Primaria,"""COLEGIO CONTADERO""",MATUTINO,ZOTITLA NO. 192,ABDIAS GARCIA SOTO,CUAJIMALPA DE MORELOS,Particular,"ZOTITLA NO. 192, ABDIAS GARCIA SOTO, CUAJIMALPA DE MORELOS",19.3533549,-99.2901474,"19.3533549,-99.2901474"
Primaria,"""COLEGIO BILINGÜE CIPRES""",MATUTINO,MORELOS No. 127,CUAJIMALPA,CUAJIMALPA DE MORELOS,Particular,"MORELOS No. 127, CUAJIMALPA, CUAJIMALPA DE MORELOS",19.3529756,-99.3043435,"19.3529756,-99.3043435"
Primaria,COLEGIO ZENTLI,MATUTINO,VOLCAN AJUSCO NO 13,LOS VOLCANES,TLALPAN,Particular,"VOLCAN AJUSCO NO 13, LOS VOLCANES, TLALPAN",19.2694314,-99.1757716,"19.2694314,-99.1757716"
Primaria,COLEGIO DARWIN,MATUTINO,DEL BOSQUE NO 9,SAN LUIS TLAXIALTEMALCO,XOCHIMILCO,Particular,"DEL BOSQUE NO 9, SAN LUIS TLAXIALTEMALCO, XOCHIMILCO",19.2595986,-99.0289056,"19.2595986,-99.0289056"
Primaria,"""MIRAVALLE NORTH HILLS""",MATUTINO,AVENIDA LINDAVISTA NO 224,LINDAVISTA,GUSTAVO A. MADERO,Particular,"AVENIDA LINDAVISTA NO 224, LINDAVISTA, GUSTAVO A. MADERO",19.4929412,-99.1265305,"19.4929412,-99.1265305"
Primaria,"""COMUNIDAD EDUCATIVA TUMBII, S.C.""",MATUTINO,CARRETERA FEDERAL A CUERNAVACA NO. 5818,SAN PEDRO MARTIR,TLALPAN,Particular,"CARRETERA FEDERAL A CUERNAVACA NO. 5818, SAN PEDRO MARTIR, TLALPAN",19.2637739,-99.1725981,"19.2637739,-99.1725981"
Primaria,LUZ DEL TEPEYAC,MATUTINO,HIDALGO NO. 4,ARAGON,GUSTAVO A. MADERO,Particular,"HIDALGO NO. 4, ARAGON, GUSTAVO A. MADERO",19.470052,-99.0856018,"19.470052,-99.0856018"
Primaria,"""KNOWLEDGE ROAD SCHOOL""",MATUTINO,AVENIDA MEXICO AJUSCO NO 500,SAN MIGUEL XICALCO,TLALPAN,Particular,"AVENIDA MEXICO AJUSCO NO 500, SAN MIGUEL XICALCO, TLALPAN",19.234489,-99.1725717,"19.234489,-99.1725717"
Primaria,INSTITUTO FIRLEFANZ,MATUTINO,ESTRELLA CEFEIDA No. 101,ESPARTACO,COYOACAN,Particular,"ESTRELLA CEFEIDA No. 101, ESPARTACO, COYOACAN",19.3169695,-99.1333282,"19.3169695,-99.1333282"
Primaria,INSTITUTO MÉXICO,MATUTINO,PROCURADURIA GENERAL DE JUSTICIA No. 234,FEDERAL,VENUSTIANO CARRANZA,Particular,"PROCURADURIA GENERAL DE JUSTICIA No. 234, FEDERAL, VENUSTIANO CARRANZA",19.4215717,-99.0867687,"19.4215717,-99.0867687"
Primaria,"COLEGIO ""ELENA GARRO""",MATUTINO,HOMBRES ILUSTRES NO 52,SANTA CECILIA TEPETLAPA,XOCHIMILCO,Particular,"HOMBRES ILUSTRES NO 52, SANTA CECILIA TEPETLAPA, XOCHIMILCO",19.2209482,-99.1002812,"19.2209482,-99.1002812"
Primaria,INSTITUTO PEDAGOGICO KAHLO DE MÉXICO,MATUTINO,AVENIDA HOMBRES ILUESTRES NO 674,SANTA CECILIA TEPETLAPA,XOCHIMILCO,Particular,"AVENIDA HOMBRES ILUESTRES NO 674, SANTA CECILIA TEPETLAPA, XOCHIMILCO",19.218939,-99.0979213,"19.218939,-99.0979213"
Primaria,"""COLEGIO LATINOAMERICANO""",MATUTINO,ORIENTE 102 NO 1752,GABRIEL RAMOS MILLAN,IZTACALCO,Particular,"ORIENTE 102 NO 1752, GABRIEL RAMOS MILLAN, IZTACALCO",19.3949301,-99.1070502,"19.3949301,-99.1070502"
Primaria,"""COLEGIO SHALOM""",MATUTINO,LUIS MURILLO NO 30,TETLALMEYA,COYOACAN,Particular,"LUIS MURILLO NO 30, TETLALMEYA, COYOACAN",19.2994945,-99.1516932,"19.2994945,-99.1516932"
Primaria,"""INSTITUTO EDUCATIVO KAURI""",MATUTINO,AVENIDA ACUEDUCTO NO 47,TEPEPAN AMPLIACION,XOCHIMILCO,Particular,"AVENIDA ACUEDUCTO NO 47, TEPEPAN AMPLIACION, XOCHIMILCO",19.253719,-99.1165861,"19.253719,-99.1165861"
Primaria,"""INSTITUTO ELIZABETH HUNDERLAGE""",MATUTINO,CALLE 4 NO 100,AGRICOLA PANTITLAN,IZTACALCO,Particular,"CALLE 4 NO 100, AGRICOLA PANTITLAN, IZTACALCO",19.4060015,-99.0632294,"19.4060015,-99.0632294"
Primaria,COCOMO MONTESSORI,MATUTINO,CULIACAN NO 86,HIPODROMO DE LA CONDESA,CUAUHTEMOC,Particular,"CULIACAN NO 86, HIPODROMO DE LA CONDESA, CUAUHTEMOC",19.405054,-99.1702875,"19.405054,-99.1702875"
Primaria,INSTITUTO EDUCATIVO RUIZ,MATUTINO,MARTÍN CARRERA NÚMERO 152,MARTIN CARRERA,GUSTAVO A. MADERO,Particular,"MARTÍN CARRERA NÚMERO 152, MARTIN CARRERA, GUSTAVO A. MADERO",19.4888159,-99.105973,"19.4888159,-99.105973"
Primaria,OAK'S LEADERSHIP SCHOOL,MATUTINO,SECRETARIA DE MARINA 519,LOMAS DE CHAMIZAL,CUAJIMALPA DE MORELOS,Particular,"SECRETARIA DE MARINA 519, LOMAS DE CHAMIZAL, CUAJIMALPA DE MORELOS",19.390187,-99.2650932,"19.390187,-99.2650932"
Primaria,"""ROOTLAND ELEMENTARY SCHOOL""",MATUTINO,TECOYOTITLA No. 88 CON ENTRADA POR HORTENSIA 6,FLORIDA,ALVARO OBREGON,Particular,"TECOYOTITLA No. 88 CON ENTRADA POR HORTENSIA 6, FLORIDA, ALVARO OBREGON",19.3565849,-99.1836288,"19.3565849,-99.1836288"
Primaria,COLEGIO VICTORIA DE LA DEMOCRACIA,MATUTINO,JOSÉ MARÍA MORELOS Y PAVON NO. 27,SANTA MARIA AZTAHUACAN,IZTAPALAPA,Particular,"JOSÉ MARÍA MORELOS Y PAVON NO. 27, SANTA MARIA AZTAHUACAN, IZTAPALAPA",19.3479712,-99.0301617,"19.3479712,-99.0301617"
Primaria,"""BRIDGEWAY NORTH AMERICAN SCHOOL""",MATUTINO,CARRILLO PUERTO NÚMERO 344 Y GRAL. MANUEL RINCÓN NÚMERO 45,GENERAL PEDRO MARIA ANAYA,BENITO JUAREZ,Particular,"CARRILLO PUERTO NÚMERO 344 Y GRAL. MANUEL RINCÓN NÚMERO 45, GENERAL PEDRO MARIA ANAYA, BENITO JUAREZ",19.3618924,-99.1607684,"19.3618924,-99.1607684"
Primaria,ESCUELA MSH,MATUTINO,PUENTE METLAC 176,PUENTE COLORADO,ALVARO OBREGON,Particular,"PUENTE METLAC 176, PUENTE COLORADO, ALVARO OBREGON",19.3472228,-99.2296961,"19.3472228,-99.2296961"
Primaria,COLEGIO ALEXANDER BAIN S.C.,MATUTINO,LAS FLORES 345,LAS AGUILAS,ALVARO OBREGON,Particular,"LAS FLORES 345, LAS AGUILAS, ALVARO OBREGON",19.3402108,-99.2353977,"19.3402108,-99.2353977"
Primaria,"KRL SCHOOL, KIDS R LEARNING",MATUTINO,AVENIDA ANDRÉS MOLINA ENRÍQUEZ No. 322,SINATEL,IZTAPALAPA,Particular,"AVENIDA ANDRÉS MOLINA ENRÍQUEZ No. 322, SINATEL, IZTAPALAPA",19.3616175,-99.1302109,"19.3616175,-99.1302109"
Primaria,"""CENTRO CULTURAL COP, S.C.""",MATUTINO,ALTAMIRANOS Y AQUILES SERDÁN NÚMERO 5,SAN PEDRO ATOCPAN,MILPA ALTA,Particular,"ALTAMIRANOS Y AQUILES SERDÁN NÚMERO 5, SAN PEDRO ATOCPAN, MILPA ALTA",19.2000167,-99.0531287,"19.2000167,-99.0531287"
Primaria,"""LICEO NACIONES UNIDAS SC""",MATUTINO,ENCUENTRO DE ACATEMPAN NO 15,SAN LORENZO LA CEBADA,XOCHIMILCO,Particular,"ENCUENTRO DE ACATEMPAN NO 15, SAN LORENZO LA CEBADA, XOCHIMILCO",19.2801113,-99.1226766,"19.2801113,-99.1226766"
Secundaria,FUNDACIÓN AZTECA,MATUTINO,AV ACUEDUCTO NUM 25,SANTA ISABEL TOLA,GUSTAVO A. MADERO,Particular,"AV ACUEDUCTO NUM 25, SANTA ISABEL TOLA, GUSTAVO A. MADERO",19.501891,-99.1180846,"19.501891,-99.1180846"
Secundaria,HISPANO AMERICANO,MATUTINO,DR. ATL No. 199,SANTA MARIA LA RIBERA,CUAUHTEMOC,Particular,"DR. ATL No. 199, SANTA MARIA LA RIBERA, CUAUHTEMOC",19.4494664,-99.1560783,"19.4494664,-99.1560783"
Secundaria,COLEGIO ISRAELITA DE MÉXICO,MATUTINO,LOMA DEL RECUERDO  44,LOMAS DE VISTA HERMOSA,CUAJIMALPA DE MORELOS,Particular,"LOMA DEL RECUERDO  44, LOMAS DE VISTA HERMOSA, CUAJIMALPA DE MORELOS",19.3796757,-99.2699458,"19.3796757,-99.2699458"
Secundaria,COLEGIO WILLIAMS,MATUTINO,EMPRESA No. 8,INSURGENTES MIXCOAC,BENITO JUAREZ,Particular,"EMPRESA No. 8, INSURGENTES MIXCOAC, BENITO JUAREZ",19.3488227,-99.1869485,"19.3488227,-99.1869485"
Secundaria,ACADEMIA MODERNA,MATUTINO,AMÉRICA 184,PARQUE SAN ANDRES,COYOACAN,Particular,"AMÉRICA 184, PARQUE SAN ANDRES, COYOACAN",19.3444903,-99.1525853,"19.3444903,-99.1525853"
Secundaria,COLEGIO LA FLORIDA,MATUTINO,INDIANA 165,NAPOLES,BENITO JUAREZ,Particular,"INDIANA 165, NAPOLES, BENITO JUAREZ",19.3865908,-99.1788346,"19.3865908,-99.1788346"
Secundaria,COLEGIO FRANCÉS PASTEUR,MATUTINO,AV. SCHILLER No. 139,POLANCO SECCION V,MIGUEL HIDALGO,Particular,"AV. SCHILLER No. 139, POLANCO SECCION V, MIGUEL HIDALGO",19.4362455,-99.1863856,"19.4362455,-99.1863856"
Secundaria,INSTITUTO DON BOSCO,MATUTINO,AVENA NO. 196,GRANJAS ESMERALDA,IZTAPALAPA,Particular,"AVENA NO. 196, GRANJAS ESMERALDA, IZTAPALAPA",19.3510509,-99.1189743,"19.3510509,-99.1189743"
Secundaria,INSTITUTO FRAY JUAN DE ZUMÁRRAGA,MATUTINO,PROVIDENCIA No. 122,DEL VALLE,BENITO JUAREZ,Particular,"PROVIDENCIA No. 122, DEL VALLE, BENITO JUAREZ",19.3989431,-99.1668628,"19.3989431,-99.1668628"
Secundaria,ISABEL GRASSETEAU,MATUTINO,ADRIAN BROWER No. 41,ALFONSO XIII,ALVARO OBREGON,Particular,"ADRIAN BROWER No. 41, ALFONSO XIII, ALVARO OBREGON",19.3753222,-99.1965215,"19.3753222,-99.1965215"
Secundaria,CRISTÓBAL COLÓN,MATUTINO,AV. MIGUEL BERNAR No. 52,LA ESCALERA,GUSTAVO A. MADERO,Particular,"AV. MIGUEL BERNAR No. 52, LA ESCALERA, GUSTAVO A. MADERO",19.5166892,-99.1435117,"19.5166892,-99.1435117"
Secundaria,REINA MARÍA,MATUTINO,RÍO BALSAS No. 12,CUAUHTEMOC,CUAUHTEMOC,Particular,"RÍO BALSAS No. 12, CUAUHTEMOC, CUAUHTEMOC",19.4335059,-99.1672922,"19.4335059,-99.1672922"
Secundaria,INSTITUTO ASUNCIÓN DE MÉXICO,MATUTINO,CALZ. DE LAS AGUILAS No. 219,LAS AGUILAS,ALVARO OBREGON,Particular,"CALZ. DE LAS AGUILAS No. 219, LAS AGUILAS, ALVARO OBREGON",19.3600114,-99.1985152,"19.3600114,-99.1985152"
Secundaria,LUZ,MATUTINO,HIDALGO No. 4,ARAGON,GUSTAVO A. MADERO,Particular,"HIDALGO No. 4, ARAGON, GUSTAVO A. MADERO",19.470052,-99.0856018,"19.470052,-99.0856018"
Secundaria,TEPEYAC MEXICANO,MATUTINO,CALLE TALARA 187,TEPEYAC INSURGENTES,GUSTAVO A. MADERO,Particular,"CALLE TALARA 187, TEPEYAC INSURGENTES, GUSTAVO A. MADERO",19.4872618,-99.1202896,"19.4872618,-99.1202896"
Secundaria,INSTITUTO COBRE DE MÉXICO,MATUTINO,CALZADA CAMARONES 206,OBRERO POPULAR,AZCAPOTZALCO,Particular,"CALZADA CAMARONES 206, OBRERO POPULAR, AZCAPOTZALCO",19.4633398,-99.1726457,"19.4633398,-99.1726457"
Secundaria,COLEGIO ROSSLAND,MATUTINO,13 DE SEPTIEMBRE 18,ESCANDON,MIGUEL HIDALGO,Particular,"13 DE SEPTIEMBRE 18, ESCANDON, MIGUEL HIDALGO",19.3988137,-99.1826855,"19.3988137,-99.1826855"
Secundaria,COLEGIO MILITARIZADO MODERNO ALARID,MATUTINO,AV. REVOLUCIÓN 462,SAN PEDRO DE LOS PINOS,BENITO JUAREZ,Particular,"AV. REVOLUCIÓN 462, SAN PEDRO DE LOS PINOS, BENITO JUAREZ",19.3922009,-99.1855873,"19.3922009,-99.1855873"
Secundaria,INSTITUTO SIMÓN BOLÍVAR,MATUTINO,MAYORAZGO DE SOLIS No. 65,XOCO,BENITO JUAREZ,Particular,"MAYORAZGO DE SOLIS No. 65, XOCO, BENITO JUAREZ",19.3639854,-99.1674453,"19.3639854,-99.1674453"
Secundaria,SIMÓN BOLÍVAR,VESPERTINO,AV. RÍO MIXCOAC No. 275,FLORIDA,ALVARO OBREGON,Particular,"AV. RÍO MIXCOAC No. 275, FLORIDA, ALVARO OBREGON",19.3618153,-99.1746379,"19.3618153,-99.1746379"
Secundaria,LA SALLE,MATUTINO,AV. FRANCIA 39,FLORIDA,ALVARO OBREGON,Particular,"AV. FRANCIA 39, FLORIDA, ALVARO OBREGON",19.3585331,-99.1820208,"19.3585331,-99.1820208"
Secundaria,FRAY GARCÍA DE CISNEROS,MATUTINO,INSURGENTES NORTE 1590,LINDAVISTA,GUSTAVO A. MADERO,Particular,"INSURGENTES NORTE 1590, LINDAVISTA, GUSTAVO A. MADERO",19.4889234,-99.1236956,"19.4889234,-99.1236956"
Secundaria,COLEGIO AVANTE,MATUTINO,ADOLFO PRIETO No. 1810,DEL VALLE,BENITO JUAREZ,Particular,"ADOLFO PRIETO No. 1810, DEL VALLE, BENITO JUAREZ",19.3651294,-99.1742293,"19.3651294,-99.1742293"
Secundaria,COLEGIO ETON,MATUTINO,CALLE SANTA LUCÍA No. 220,CLUB DE GOLF PRADOS DE LA MONTAÑA,CUAJIMALPA DE MORELOS,Particular,"CALLE SANTA LUCÍA No. 220, CLUB DE GOLF PRADOS DE LA MONTAÑA, CUAJIMALPA DE MORELOS",19.3876706,-99.2509925,"19.3876706,-99.2509925"
Secundaria,INSTITUTO VILLA DE CORTÉS,MATUTINO,PLUTARCO ELÍAS CALLES N°1136,MILITAR MARTE,IZTACALCO,Particular,"PLUTARCO ELÍAS CALLES N°1136, MILITAR MARTE, IZTACALCO",19.385302,-99.133477,"19.385302,-99.133477"
Secundaria,LICEO MEXICANO JAPONÉS,MATUTINO,CAMINO SANTA TERESA 1500,JARDINES DEL PEDREGAL,ALVARO OBREGON,Particular,"CAMINO SANTA TERESA 1500, JARDINES DEL PEDREGAL, ALVARO OBREGON",19.3090831,-99.2117564,"19.3090831,-99.2117564"
Secundaria,INSTITUTO TÉCNICO Y CULTURAL,MATUTINO,XOCHICALCO 495,VERTIZ NARVARTE,BENITO JUAREZ,Particular,"XOCHICALCO 495, VERTIZ NARVARTE, BENITO JUAREZ",19.3827111,-99.1553297,"19.3827111,-99.1553297"
Secundaria,WILLIAM H. KILPATRICK,VESPERTINO,MANUEL ÁVILA CAMACHO No. 605,PERIODISTA,MIGUEL HIDALGO,Particular,"MANUEL ÁVILA CAMACHO No. 605, PERIODISTA, MIGUEL HIDALGO",19.4485866,-99.219998,"19.4485866,-99.219998"
Secundaria,SÓCRATES,MATUTINO,XOMPOL No.51 DE LA CARR XALPA-SAN MIGUEL TOPÍLEJO,SAN MATEO XALPA,XOCHIMILCO,Particular,"XOMPOL No.51 DE LA CARR XALPA-SAN MIGUEL TOPÍLEJO, SAN MATEO XALPA, XOCHIMILCO",19.2088639,-99.1266032,"19.2088639,-99.1266032"
Secundaria,SECUNDARIA INSTITUTO NUEVA INGLATERRA,MATUTINO,SAN JUAN DE DIOS No.11,SAN LORENZO HUIPULCO,TLALPAN,Particular,"SAN JUAN DE DIOS No.11, SAN LORENZO HUIPULCO, TLALPAN",19.2972455,-99.1512583,"19.2972455,-99.1512583"
Secundaria,INSTITUTO CULTURAL FRANCÉS,MATUTINO,JOSÉ MARÍA CASTILLO VELASCO 51,PERIODISTA,MIGUEL HIDALGO,Particular,"JOSÉ MARÍA CASTILLO VELASCO 51, PERIODISTA, MIGUEL HIDALGO",19.4477765,-99.2178281,"19.4477765,-99.2178281"
Secundaria,LOGOS,MATUTINO,MANUEL LÓPEZ COTILLA 1822,DEL VALLE,BENITO JUAREZ,Particular,"MANUEL LÓPEZ COTILLA 1822, DEL VALLE, BENITO JUAREZ",19.3637008,-99.1704965,"19.3637008,-99.1704965"
Secundaria,ABC KIDS JUNIOR HIGH,MATUTINO,ORIENTE 257 No. 276,AGRICOLA ORIENTAL,IZTACALCO,Particular,"ORIENTE 257 No. 276, AGRICOLA ORIENTAL, IZTACALCO",19.3904228,-99.0635077,"19.3904228,-99.0635077"
Secundaria,NUEVO CONTINENTE,MATUTINO,NICOLÁS SAN JUAN No. 1141,DEL VALLE,BENITO JUAREZ,Particular,"NICOLÁS SAN JUAN No. 1141, DEL VALLE, BENITO JUAREZ",19.3808508,-99.1641324,"19.3808508,-99.1641324"
Secundaria,COLEGIO WILLIAM BLAKE,MATUTINO,SHAKESPEARE No. 81,ANZURES,MIGUEL HIDALGO,Particular,"SHAKESPEARE No. 81, ANZURES, MIGUEL HIDALGO",19.4287281,-99.1772287,"19.4287281,-99.1772287"
Secundaria,CENTRO EDUCATIVO TOMÁS MORO,MATUTINO,CALLE MAGUEY 64,SAN JOSE DE LOS CEDROS,CUAJIMALPA DE MORELOS,Particular,"CALLE MAGUEY 64, SAN JOSE DE LOS CEDROS, CUAJIMALPA DE MORELOS",19.3626419,-99.2909804,"19.3626419,-99.2909804"
Secundaria,SECUNDARIA ECA,MATUTINO,CALLE B No. 20 MANZANA XI,EDUCACION,COYOACAN,Particular,"CALLE B No. 20 MANZANA XI, EDUCACION, COYOACAN",19.3383873,-99.1341132,"19.3383873,-99.1341132"
Secundaria,DOMINGO SAVIO,MATUTINO,GRAL. ARISTA 96,ARGENTINA PONIENTE,MIGUEL HIDALGO,Particular,"GRAL. ARISTA 96, ARGENTINA PONIENTE, MIGUEL HIDALGO",19.4589885,-99.2108665,"19.4589885,-99.2108665"
Secundaria,ALEJANDRO GUILLOT,MATUTINO,RANCHO CAMICHINES No. 19,NUEVA ORIENTAL,TLALPAN,Particular,"RANCHO CAMICHINES No. 19, NUEVA ORIENTAL, TLALPAN",19.2970108,-99.1293371,"19.2970108,-99.1293371"
Secundaria,DECROLY,MATUTINO,ZACATECAS No. 88,ROMA NORTE,CUAUHTEMOC,Particular,"ZACATECAS No. 88, ROMA NORTE, CUAUHTEMOC",19.4158314,-99.1583504,"19.4158314,-99.1583504"
Secundaria,CENTRO ESCOLAR LANCASTER,MATUTINO,HACIENDA ESCOLÁSTICA No. 66,LA PROVIDENCIA,AZCAPOTZALCO,Particular,"HACIENDA ESCOLÁSTICA No. 66, LA PROVIDENCIA, AZCAPOTZALCO",19.4953724,-99.2107906,"19.4953724,-99.2107906"
Secundaria,MANUEL ACOSTA,MATUTINO,RÍO SENA No. 42,CUAUHTEMOC,CUAUHTEMOC,Particular,"RÍO SENA No. 42, CUAUHTEMOC, CUAUHTEMOC",19.4319938,-99.1667274,"19.4319938,-99.1667274"
Secundaria,INSTITUTO ATENIENSE,MATUTINO,ELSA No. 7,GUADALUPE TEPEYAC,GUSTAVO A. MADERO,Particular,"ELSA No. 7, GUADALUPE TEPEYAC, GUSTAVO A. MADERO",19.4638744,-99.1223339,"19.4638744,-99.1223339"
Secundaria,COLEGIO RAFAEL RAMÍREZ,MATUTINO,VICENTE GUERRERO No. 70,SAN MIGUEL AMPLIACION,IZTAPALAPA,Particular,"VICENTE GUERRERO No. 70, SAN MIGUEL AMPLIACION, IZTAPALAPA",19.3379979,-99.0689778,"19.3379979,-99.0689778"
Secundaria,BETH YAACOV,MATUTINO,RAFAEL ALDUCÍN No. 8,PERIODISTA,MIGUEL HIDALGO,Particular,"RAFAEL ALDUCÍN No. 8, PERIODISTA, MIGUEL HIDALGO",,,
Secundaria,"COLEGIO O'FARRILL SECUNDARIA Y PREPARATORIA, SOCIEDAD CIVIL",MATUTINO,HORTENSIA No. 11,MIGUEL HIDALGO AMPLIACION,TLALPAN,Particular,"HORTENSIA No. 11, MIGUEL HIDALGO AMPLIACION, TLALPAN",19.2772041,-99.2075967,"19.2772041,-99.2075967"
Secundaria,EL COLEGIO BRITÁNICO (THE EDRON ACADEMY),MATUTINO,CALZ. DESIERTO DE LOS LEONES 5578,OLIVAR DE LOS PADRES,ALVARO OBREGON,Particular,"CALZ. DESIERTO DE LOS LEONES 5578, OLIVAR DE LOS PADRES, ALVARO OBREGON",19.3423692,-99.226005,"19.3423692,-99.226005"
Secundaria,COLEGIO ST. JOHN'S,MATUTINO,AV. TENORIOS No. 80,RAMOS MILLAN COAPA,TLALPAN,Particular,"AV. TENORIOS No. 80, RAMOS MILLAN COAPA, TLALPAN",19.2993797,-99.1201207,"19.2993797,-99.1201207"
Secundaria,JERÓNIMO MARIANO USERA Y ALARCÓN,MATUTINO,AV. VENUSTIANO CARRANZA No. 1419,CUAUTEPEC BARRIO ALTO,GUSTAVO A. MADERO,Particular,"AV. VENUSTIANO CARRANZA No. 1419, CUAUTEPEC BARRIO ALTO, GUSTAVO A. MADERO",19.553539,-99.136405,"19.553539,-99.136405"
Secundaria,EDUARDO JENNER,MATUTINO,AV. SAN JUAN DE LOS LAGOS ESQ. TALPA S/N,SAN FELIPE DE JESUS,GUSTAVO A. MADERO,Particular,"AV. SAN JUAN DE LOS LAGOS ESQ. TALPA S/N, SAN FELIPE DE JESUS, GUSTAVO A. MADERO",19.4982931,-99.0755586,"19.4982931,-99.0755586"
Secundaria,COLEGIO ZACATECAS,MATUTINO,GENERAL SANTANA No. 155,MARTIN CARRERA,GUSTAVO A. MADERO,Particular,"GENERAL SANTANA No. 155, MARTIN CARRERA, GUSTAVO A. MADERO",19.4876546,-99.1065073,"19.4876546,-99.1065073"
Secundaria,COLEGIO BOSQUES DEL CONTADERO,MATUTINO,COAHUILA No. 75,CUAJIMALPA,CUAJIMALPA DE MORELOS,Particular,"COAHUILA No. 75, CUAJIMALPA, CUAJIMALPA DE MORELOS",19.3572011,-99.293439,"19.3572011,-99.293439"
Secundaria,COLEGIO GALILEO GALILEI,MATUTINO,TENOSIQUE No. 379,HEROES DE PADIERNA,TLALPAN,Particular,"TENOSIQUE No. 379, HEROES DE PADIERNA, TLALPAN",19.2857913,-99.2277916,"19.2857913,-99.2277916"
Secundaria,BIK'IT,MATUTINO,RÍO CAZONES NO. 42,PASEOS DE CHURUBUSCO,IZTAPALAPA,Particular,"RÍO CAZONES NO. 42, PASEOS DE CHURUBUSCO, IZTAPALAPA",19.3844616,-99.0887543,"19.3844616,-99.0887543"
Secundaria,JUAN PALOMO MARTÍNEZ,MATUTINO,AVENIDA TLAHUAC 7328,SANTA CECILIA,TLAHUAC,Particular,"AVENIDA TLAHUAC 7328, SANTA CECILIA, TLAHUAC",19.2808194,-99.0088565,"19.2808194,-99.0088565"
Secundaria,SECUNDARIA TULYEHUALCO,MATUTINO,FRANCISCO VILLA No. 20,QUIAHUATLA,TLAHUAC,Particular,"FRANCISCO VILLA No. 20, QUIAHUATLA, TLAHUAC",19.2595258,-99.0082214,"19.2595258,-99.0082214"
Secundaria,SECUNDARIA ALHER ACUEDUCTO,MATUTINO,CALLE DE LA CIMA No. 9,ACUEDUCTO DE GUADALUPE,GUSTAVO A. MADERO,Particular,"CALLE DE LA CIMA No. 9, ACUEDUCTO DE GUADALUPE, GUSTAVO A. MADERO",19.5241517,-99.1459396,"19.5241517,-99.1459396"
Secundaria,COLEGIO SKINNER,MATUTINO,RÍO TUXPAN NO. 70,PASEOS DE CHURUBUSCO,IZTAPALAPA,Particular,"RÍO TUXPAN NO. 70, PASEOS DE CHURUBUSCO, IZTAPALAPA",19.3871577,-99.0877118,"19.3871577,-99.0877118"
Secundaria,WESTHILL INSTITUTE,MATUTINO,DOMINGO GARCÍA RAMOS No. 56,CLUB DE GOLF PRADOS DE LA MONTAÑA,CUAJIMALPA DE MORELOS,Particular,"DOMINGO GARCÍA RAMOS No. 56, CLUB DE GOLF PRADOS DE LA MONTAÑA, CUAJIMALPA DE MORELOS",19.3578017,-99.2654125,"19.3578017,-99.2654125"
Secundaria,LICEO EMPERADORES AZTECAS,MATUTINO,MANUEL ACUÑA NO.114,JACARANDAS,IZTAPALAPA,Particular,"MANUEL ACUÑA NO.114, JACARANDAS, IZTAPALAPA",19.3472733,-99.0528716,"19.3472733,-99.0528716"
Secundaria,CENTRO EDUCACIONAL WALTER C.BUCHANAN,MATUTINO,HOLBEIN No. 61,SAN JUAN,BENITO JUAREZ,Particular,"HOLBEIN No. 61, SAN JUAN, BENITO JUAREZ",19.3806563,-99.1835576,"19.3806563,-99.1835576"
Secundaria,COLEGIO INTERNACIONAL TLALPAN,MATUTINO,CARR. FED. A CUERNAVACA KM. 24 No. 6871,SAN ANDRES TOTOLTEPEC,TLALPAN,Particular,"CARR. FED. A CUERNAVACA KM. 24 No. 6871, SAN ANDRES TOTOLTEPEC, TLALPAN",19.2421512,-99.1676483,"19.2421512,-99.1676483"
Secundaria,INSTITUTO CANADIENSE CLARAC,MATUTINO,CARRETERA A SAN PABLO No. 374,SANTIAGO TEPALCATLAPAN,XOCHIMILCO,Particular,"CARRETERA A SAN PABLO No. 374, SANTIAGO TEPALCATLAPAN, XOCHIMILCO",19.2538922,-99.1203923,"19.2538922,-99.1203923"
Secundaria,COLEGIO FLORENCIA NIGHTINGALE,MATUTINO,SIRENA 48,INDUSTRIAL,GUSTAVO A. MADERO,Particular,"SIRENA 48, INDUSTRIAL, GUSTAVO A. MADERO",19.4800769,-99.1279795,"19.4800769,-99.1279795"
Secundaria,INSTITUTO VILLA DEL SUR,MATUTINO,LIMONES ESQ AV XOCHITEPEC No. 50,SANTA CRUZ XOCHITEPEC,XOCHIMILCO,Particular,"LIMONES ESQ AV XOCHITEPEC No. 50, SANTA CRUZ XOCHITEPEC, XOCHIMILCO",19.2596907,-99.126981,"19.2596907,-99.126981"
Secundaria,COLEGIO BRITANIA,MATUTINO,AVENIDA SANTA LUCÍA No. 1533,COLINAS DEL SUR,ALVARO OBREGON,Particular,"AVENIDA SANTA LUCÍA No. 1533, COLINAS DEL SUR, ALVARO OBREGON",19.3668194,-99.2325443,"19.3668194,-99.2325443"
