NIVEL,NOMBRE,TURNO,DOMICILIO,COLONIA,ALCALDÍA,SOSTENIMIENTO,ubicacion,lat,lon,coordenadas
Preescolar,CULTURAS DE MÉXICO,MATUTINO,MANUEL M. LOPEZ S/N MZA. 79 LT. 10,BARRIO SANTA ANA ZAPOTITLAN,TLAHUAC,Particular,"MANUEL M. LOPEZ S/N MZA. 79 LT. 10, BARRIO SANTA ANA ZAPOTITLAN, TLAHUAC",19.3025044,-99.0440041,"19.3025044,-99.0440041"
Preescolar,LICEO INFANTIL MODERNO,MATUTINO,FALSTAFF ( ANTES INDEPENDENCIA ) NO. 268,LA NOPALERA,TLAHUAC,Particular,"FALSTAFF ( ANTES INDEPENDENCIA ) NO. 268, LA NOPALERA, TLAHUAC",19.2967749,-99.0543938,"19.2967749,-99.0543938"
Preescolar,JARDIN DE NIÑOS Y NIÑAS GARABATOS,MATUTINO,PESCADO NO. 79 MZA. 34 LT. 19,DEL MAR,TLAHUAC,Particular,"PESCADO NO. 79 MZA. 34 LT. 19, DEL MAR, TLAHUAC",19.2902609,-99.0582577,"19.2902609,-99.0582577"
Preescolar,JARDIN DE NIÑOS SHADDAY,MATUTINO,RET. 11 GENARO GARCIA NO. 10 GPO.19 E-32,JARDIN BALBUENA,VENUSTIANO CARRANZA,Particular,"RET. 11 GENARO GARCIA NO. 10 GPO.19 E-32, JARDIN BALBUENA, VENUSTIANO CARRANZA",19.4170148,-99.1087534,"19.4170148,-99.1087534"
Preescolar,JARDIN DE NIÑOS VIENA,MATUTINO,XINANTECATL NO. 93,ARENAL 3A SECCION,VENUSTIANO CARRANZA,Particular,"XINANTECATL NO. 93, ARENAL 3A SECCION, VENUSTIANO CARRANZA",19.4289864,-99.0562092,"19.4289864,-99.0562092"
Preescolar,INSTITUTO PEDAGOGICO INFANTIL MÉXICO,MATUTINO,PROCURADURIA GRAL. DE JUSTICIA NO. 234,FEDERAL,VENUSTIANO CARRANZA,Particular,"PROCURADURIA GRAL. DE JUSTICIA NO. 234, FEDERAL, VENUSTIANO CARRANZA",19.4215717,-99.0867687,"19.4215717,-99.0867687"
Preescolar,SEMILLITAS DEL INSTITUTO INGLES MEXICANO,MATUTINO,RANCHO DEL VERGEL NO. 130,PRADO COAPA,TLALPAN,Particular,"RANCHO DEL VERGEL NO. 130, PRADO COAPA, TLALPAN",19.3023008,-99.1275646,"19.3023008,-99.1275646"
Preescolar,JARDIN DE NIÑOS LA ESMERALDA,MATUTINO,NORTE 94 NO. 8310,LA ESMERALDA I,GUSTAVO A. MADERO,Particular,"NORTE 94 NO. 8310, LA ESMERALDA I, GUSTAVO A. MADERO",19.484127,-99.086565,"19.484127,-99.086565"
Preescolar,JARDÍN DE NIÑOS CHRIS,MATUTINO,MASSENET No. 144,PERALVILLO,CUAUHTEMOC,Particular,"MASSENET No. 144, PERALVILLO, CUAUHTEMOC",19.4641696,-99.1381459,"19.4641696,-99.1381459"
Preescolar,MAGICO DE LOS NIÑOS,MATUTINO,14 DE JULIO (ANTES CAPITALES) NO. 43,SAN MARCOS,XOCHIMILCO,Particular,"14 DE JULIO (ANTES CAPITALES) NO. 43, SAN MARCOS, XOCHIMILCO",19.2613808,-99.1142091,"19.2613808,-99.1142091"
Preescolar,MAESTRO CARLOS CHAVEZ,MATUTINO,PROLONGACION DIVISION DEL NORTE NO. 5466,SAN MARCOS,XOCHIMILCO,Particular,"PROLONGACION DIVISION DEL NORTE NO. 5466, SAN MARCOS, XOCHIMILCO",19.2619816,-99.112797,"19.2619816,-99.112797"
Preescolar,JARDIN DE NIÑOS PALAS ATENEA,MATUTINO,5 DE MAYO NO. 111,SANTIAGO TEPALCATLAPAN,XOCHIMILCO,Particular,"5 DE MAYO NO. 111, SANTIAGO TEPALCATLAPAN, XOCHIMILCO",19.2571104,-99.1035259,"19.2571104,-99.1035259"
Preescolar,COLEGIO CUAUHTZIN,MATUTINO,HOMBRES ILUSTRES NO.640,SANTA CECILIA TEPETLAPA,XOCHIMILCO,Particular,"HOMBRES ILUSTRES NO.640, SANTA CECILIA TEPETLAPA, XOCHIMILCO",19.2202781,-99.097539,"19.2202781,-99.097539"
Preescolar,COLEGIO AMEYALLI,MATUTINO,JACARANDAS NO.61,SAN GREGORIO ATLAPULCO,XOCHIMILCO,Particular,"JACARANDAS NO.61, SAN GREGORIO ATLAPULCO, XOCHIMILCO",19.2531573,-99.0557268,"19.2531573,-99.0557268"
Preescolar,CENTRO EDUCATIVO ALFRED ADLER,MATUTINO,SUR 112 A  NO. 27,COVE,ALVARO OBREGON,Particular,"SUR 112 A  NO. 27, COVE, ALVARO OBREGON",19.4020129,-99.1971286,"19.4020129,-99.1971286"
Preescolar,FRAY GARCÍA DE CISNEROS,MATUTINO,INSURGENTES NORTE NO. 1590,LINDAVISTA,GUSTAVO A. MADERO,Particular,"INSURGENTES NORTE NO. 1590, LINDAVISTA, GUSTAVO A. MADERO",19.4889234,-99.1236956,"19.4889234,-99.1236956"
Preescolar,ENRIQUE DUNANT,MATUTINO,BOULEVARD DEL TEMOLUCO NO. 108,ACUEDUCTO DE GUADALUPE,GUSTAVO A. MADERO,Particular,"BOULEVARD DEL TEMOLUCO NO. 108, ACUEDUCTO DE GUADALUPE, GUSTAVO A. MADERO",19.5237577,-99.146137,"19.5237577,-99.146137"
Preescolar,CENTRO ESCOLAR EDUCATIVO HARLEQUIN,MATUTINO,AV. LOMAS DE GUADALUPE NO. 290,LOMAS DE GUADALUPE FRACCIONAMIENTO,ALVARO OBREGON,Particular,"AV. LOMAS DE GUADALUPE NO. 290, LOMAS DE GUADALUPE FRACCIONAMIENTO, ALVARO OBREGON",19.3408115,-99.2480115,"19.3408115,-99.2480115"
Preescolar,LAS HORAS FELICES,MATUTINO,ZACATECAS  NO. 2,PROVIDENCIA,GUSTAVO A. MADERO,Particular,"ZACATECAS  NO. 2, PROVIDENCIA, GUSTAVO A. MADERO",19.4837595,-99.0704637,"19.4837595,-99.0704637"
Preescolar,HIGHLANDS INTERNATIONAL,MATUTINO,FARALLON NO. 125,JARDINES DEL PEDREGAL,ALVARO OBREGON,Particular,"FARALLON NO. 125, JARDINES DEL PEDREGAL, ALVARO OBREGON",19.3198044,-99.1983651,"19.3198044,-99.1983651"
Preescolar,GREAT KIDS KINDERGARDEN,MATUTINO,FARALLON NO. 151,JARDINES DEL PEDREGAL,ALVARO OBREGON,Particular,"FARALLON NO. 151, JARDINES DEL PEDREGAL, ALVARO OBREGON",19.3198108,-99.1996766,"19.3198108,-99.1996766"
Preescolar,LECHE KIDS SCHOOL,MATUTINO,AV. 539 NO. 105,SAN JUAN DE ARAGON,GUSTAVO A. MADERO,Particular,"AV. 539 NO. 105, SAN JUAN DE ARAGON, GUSTAVO A. MADERO",19.4550748,-99.0881414,"19.4550748,-99.0881414"
Preescolar,CENTRO DE EDUCACIÓN PREESCOLAR SIGLO XXI,MATUTINO,RETORNO 35 DE CECILIO ROBELO NO. 52,JARDIN BALBUENA,VENUSTIANO CARRANZA,Particular,"RETORNO 35 DE CECILIO ROBELO NO. 52, JARDIN BALBUENA, VENUSTIANO CARRANZA",19.420522,-99.105477,"19.420522,-99.105477"
Preescolar,INSTITUTO BAJA CALIFORNIA,MATUTINO,GUANABANA NO. 73,NUEVA SANTA MARIA,AZCAPOTZALCO,Particular,"GUANABANA NO. 73, NUEVA SANTA MARIA, AZCAPOTZALCO",19.4602848,-99.1687304,"19.4602848,-99.1687304"
Preescolar,JARDIN DE NIÑOS DE LA ESCUELA INTERNACIONAL,MATUTINO,CRUZ BLANCA NO. 15,DEL CARMEN,COYOACAN,Particular,"CRUZ BLANCA NO. 15, DEL CARMEN, COYOACAN",19.3519417,-99.153149,"19.3519417,-99.153149"
Preescolar,JARDIN DE NIÑOS OCEANO,MATUTINO,TRUCHA NO 57,CARACOL,VENUSTIANO CARRANZA,Particular,"TRUCHA NO 57, CARACOL, VENUSTIANO CARRANZA",19.4272003,-99.0714169,"19.4272003,-99.0714169"
Preescolar,CENTRO DE DESARROLLO INFANTIL SOLECITO,MATUTINO,SAN ALBERTO MZA. 579 LT.4,SANTA URSULA COAPA,COYOACAN,Particular,"SAN ALBERTO MZA. 579 LT.4, SANTA URSULA COAPA, COYOACAN",19.3150249,-99.1515655,"19.3150249,-99.1515655"
Preescolar,CENTRO ESCOLAR BRITANNIA,MATUTINO,CORDOBANES NO. 32,SAN JOSE INSURGENTES,BENITO JUAREZ,Particular,"CORDOBANES NO. 32, SAN JOSE INSURGENTES, BENITO JUAREZ",19.3658384,-99.1864272,"19.3658384,-99.1864272"
Preescolar,COLEGIO WESTMOUNT,MATUTINO,DR. JOSE MARIA VERTIZ NO. 1221,VERTIZ NARVARTE,BENITO JUAREZ,Particular,"DR. JOSE MARIA VERTIZ NO. 1221, VERTIZ NARVARTE, BENITO JUAREZ",19.3771717,-99.1539614,"19.3771717,-99.1539614"
Preescolar,JARDIN DE NIÑOS SIMBA,MATUTINO,AVENIDA JARDIN  NO. 41,TLATILCO,AZCAPOTZALCO,Particular,"AVENIDA JARDIN  NO. 41, TLATILCO, AZCAPOTZALCO",19.4579127,-99.1637565,"19.4579127,-99.1637565"
Preescolar,JARDIN DE NIÑOS DINOS,MATUTINO,OASIS NO. 35,CLAVERIA,AZCAPOTZALCO,Particular,"OASIS NO. 35, CLAVERIA, AZCAPOTZALCO",19.4662294,-99.1840432,"19.4662294,-99.1840432"
Preescolar,ESCUELA HERMINIO ALMENDROS,MATUTINO,CHIMALCOYOTL NO. 99,TORIELLO GUERRA,TLALPAN,Particular,"CHIMALCOYOTL NO. 99, TORIELLO GUERRA, TLALPAN",19.2953884,-99.1634832,"19.2953884,-99.1634832"
Preescolar,AMANECER,MATUTINO,CALLE 321 NO. 634,NUEVA ATZACOALCO,GUSTAVO A. MADERO,Particular,"CALLE 321 NO. 634, NUEVA ATZACOALCO, GUSTAVO A. MADERO",19.4994643,-99.0840437,"19.4994643,-99.0840437"
Preescolar,COLEGIO SANTA TERESA,MATUTINO,TOLUCA NO. 44,SANTA TERESA,LA MAGDALENA CONTRERAS,Particular,"TOLUCA NO. 44, SANTA TERESA, LA MAGDALENA CONTRERAS",19.3087606,-99.2294797,"19.3087606,-99.2294797"
Preescolar,CENTRO INFANTIL FELIPE NERI,MATUTINO,OTOMIES NO. 189,AJUSCO,COYOACAN,Particular,"OTOMIES NO. 189, AJUSCO, COYOACAN",19.3149935,-99.1599388,"19.3149935,-99.1599388"
Preescolar,CENTRO EDUCATIVO MONTREAL,MATUTINO,UXMAL NO. 266,NARVARTE,BENITO JUAREZ,Particular,"UXMAL NO. 266, NARVARTE, BENITO JUAREZ",19.3917932,-99.1547,"19.3917932,-99.1547"
Preescolar,RO.MA.L.I.,MATUTINO,TORRENTE NO. 110,ALPES,ALVARO OBREGON,Particular,"TORRENTE NO. 110, ALPES, ALVARO OBREGON",19.3555313,-99.2092681,"19.3555313,-99.2092681"
Preescolar,EL MUNDO DE LOS NIÑOS,MATUTINO,CALLE 5 NO. 122,ZARAGOZA,VENUSTIANO CARRANZA,Particular,"CALLE 5 NO. 122, ZARAGOZA, VENUSTIANO CARRANZA",19.4059611,-99.0615199,"19.4059611,-99.0615199"
Preescolar,NENET CALLI MONTESSORI,MATUTINO,TLACOQUEMECATL NO. 69,DEL VALLE,BENITO JUAREZ,Particular,"TLACOQUEMECATL NO. 69, DEL VALLE, BENITO JUAREZ",19.3783377,-99.1748893,"19.3783377,-99.1748893"
Preescolar,JARDÍN DE NIÑOS BERACA,MATUTINO,NORTE 25-A NO. 53,NUEVA VALLEJO,GUSTAVO A. MADERO,Particular,"NORTE 25-A NO. 53, NUEVA VALLEJO, GUSTAVO A. MADERO",19.4931753,-99.149719,"19.4931753,-99.149719"
Preescolar,KINDER MIRAVALLE,MATUTINO,LATACUNGA NO. 786,LINDAVISTA,GUSTAVO A. MADERO,Particular,"LATACUNGA NO. 786, LINDAVISTA, GUSTAVO A. MADERO",19.4915585,-99.127563,"19.4915585,-99.127563"
Preescolar,COLEGIO WILLIAM JONES,MATUTINO,TACTUANI NO. 2,RICARDO FLORES MAGON,IZTAPALAPA,Particular,"TACTUANI NO. 2, RICARDO FLORES MAGON, IZTAPALAPA",19.3548383,-99.0978177,"19.3548383,-99.0978177"
Preescolar,COLEGIO LIBERTADOR SIMON BOLIVAR,MATUTINO,TINTORERA NO. 39,DEL MAR,TLAHUAC,Particular,"TINTORERA NO. 39, DEL MAR, TLAHUAC",19.2872468,-99.0664629,"19.2872468,-99.0664629"
Preescolar,COLEGIO PEDAGÓGICO LOS ANGELES,MATUTINO,HERMENEGILDO GALENA NO. 9,SAN FRANCISCO TLALTENCO,TLAHUAC,Particular,"HERMENEGILDO GALENA NO. 9, SAN FRANCISCO TLALTENCO, TLAHUAC",19.2937409,-99.0182164,"19.2937409,-99.0182164"
Preescolar,COLEGIO DE EDUCACIÓN Y DESARROLLO INFANTIL ZACATENCO,MATUTINO,SALAVERRY NO.1073,RESIDENCIAL ZACATENCO,GUSTAVO A. MADERO,Particular,"SALAVERRY NO.1073, RESIDENCIAL ZACATENCO, GUSTAVO A. MADERO",19.5029814,-99.1263866,"19.5029814,-99.1263866"
Preescolar,COLEGIO BILINGÜE WINDSOR,MATUTINO,AV. SANTA ANA NO. 368,SAN FRANCISCO CULHUACAN,COYOACAN,Particular,"AV. SANTA ANA NO. 368, SAN FRANCISCO CULHUACAN, COYOACAN",19.3293522,-99.1223339,"19.3293522,-99.1223339"
Preescolar,JARDÍN DE NIÑOS ANGELES,MATUTINO,PIZAGUA NO. 1237 MZ. 9 LT. 263,SAN PEDRO ZACATENCO,GUSTAVO A. MADERO,Particular,"PIZAGUA NO. 1237 MZ. 9 LT. 263, SAN PEDRO ZACATENCO, GUSTAVO A. MADERO",19.5069515,-99.1214045,"19.5069515,-99.1214045"
Preescolar,CENTRO DE MOVIMIENTO Y APRENDIZAJE MALU,MATUTINO,LA ESCOLLERA NO. 15 MZA. 16 LT. 38,ACUEDUCTO DE GUADALUPE,GUSTAVO A. MADERO,Particular,"LA ESCOLLERA NO. 15 MZA. 16 LT. 38, ACUEDUCTO DE GUADALUPE, GUSTAVO A. MADERO",19.5227237,-99.1497171,"19.5227237,-99.1497171"
Preescolar,ERASMO CASTELLANOS QUINTO,MATUTINO,CDA. TREBOL NO. 2,CITLALI,IZTAPALAPA,Particular,"CDA. TREBOL NO. 2, CITLALI, IZTAPALAPA",19.3416472,-99.0235342,"19.3416472,-99.0235342"
Preescolar,INSTITUTO EDUCATIVO OLINCA,MATUTINO,PERIFERICO SUR NO. 5180,PEDREGAL DE CARRASCO,COYOACAN,Particular,"PERIFERICO SUR NO. 5180, PEDREGAL DE CARRASCO, COYOACAN",19.3033879,-99.1760169,"19.3033879,-99.1760169"
Preescolar,COLEGIO VON GLÜMER,MATUTINO,JOSE MARIA CASTORENA NO. 412,CUAJIMALPA,CUAJIMALPA DE MORELOS,Particular,"JOSE MARIA CASTORENA NO. 412, CUAJIMALPA, CUAJIMALPA DE MORELOS",19.3616179,-99.2895458,"19.3616179,-99.2895458"
Preescolar,COLEGIO CELESTIN FREINET,MATUTINO,GUADALUPE I. RAMIREZ NO.111,SAN LUCAS XOCHIMANCA,XOCHIMILCO,Particular,"GUADALUPE I. RAMIREZ NO.111, SAN LUCAS XOCHIMANCA, XOCHIMILCO",19.2647791,-99.1091017,"19.2647791,-99.1091017"
Preescolar,MONINA,MATUTINO,LATINOS NO. 172,MODERNA,BENITO JUAREZ,Particular,"LATINOS NO. 172, MODERNA, BENITO JUAREZ",19.3928197,-99.1333505,"19.3928197,-99.1333505"
Preescolar,LICEO PREESCOLAR MEXICANO,MATUTINO,PRESA VALSEQUILLO NO. 47 MZA. 5 LT. 239,IRRIGACION,MIGUEL HIDALGO,Particular,"PRESA VALSEQUILLO NO. 47 MZA. 5 LT. 239, IRRIGACION, MIGUEL HIDALGO",19.4439686,-99.2135091,"19.4439686,-99.2135091"
Preescolar,CENTRO EDUCATIVO TOMAS MORO,MATUTINO,MAGUEY NO. 64,SAN JOSE DE LOS CEDROS,CUAJIMALPA DE MORELOS,Particular,"MAGUEY NO. 64, SAN JOSE DE LOS CEDROS, CUAJIMALPA DE MORELOS",19.3626419,-99.2909804,"19.3626419,-99.2909804"
Preescolar,COLEGIO FRANCES NUEVA SANTA MARIA,MATUTINO,BEGONIAS NO. 103,NUEVA SANTA MARIA,AZCAPOTZALCO,Particular,"BEGONIAS NO. 103, NUEVA SANTA MARIA, AZCAPOTZALCO",19.4632314,-99.1655514,"19.4632314,-99.1655514"
Preescolar,LA CASA DEL COLIBRI,MATUTINO,GOB. MANUEL REYES VERAMENDI NO. 37 Y 39,SAN MIGUEL CHAPULTEPEC,MIGUEL HIDALGO,Particular,"GOB. MANUEL REYES VERAMENDI NO. 37 Y 39, SAN MIGUEL CHAPULTEPEC, MIGUEL HIDALGO",19.4056776,-99.1869799,"19.4056776,-99.1869799"
Preescolar,EL MUNDO DE LOS NIÑOS,MATUTINO,CENTENARIO NO. 55 BIS,MERCED GOMEZ,ALVARO OBREGON,Particular,"CENTENARIO NO. 55 BIS, MERCED GOMEZ, ALVARO OBREGON",19.365962,-99.194836,"19.365962,-99.194836"
Preescolar,INSTITUTO PREESCOLAR NIÑO AZTECA,MATUTINO,CALLE 16 A NO. 34,SANTA ROSA,GUSTAVO A. MADERO,Particular,"CALLE 16 A NO. 34, SANTA ROSA, GUSTAVO A. MADERO",19.5221149,-99.1668782,"19.5221149,-99.1668782"
Preescolar,DANIELI,MATUTINO,CALZ. IGNACIO ZARAGOZA MZ. 122 LT. 16,SANTA MARTHA ACATITLA AMPLIACION,IZTAPALAPA,Particular,"CALZ. IGNACIO ZARAGOZA MZ. 122 LT. 16, SANTA MARTHA ACATITLA AMPLIACION, IZTAPALAPA",19.3647194,-99.0062358,"19.3647194,-99.0062358"
Preescolar,WEST MIDLANDS COLLEGE,MATUTINO,NORTE 81  NO.  231,CLAVERIA,AZCAPOTZALCO,Particular,"NORTE 81  NO.  231, CLAVERIA, AZCAPOTZALCO",19.4679025,-99.1783834,"19.4679025,-99.1783834"
Preescolar,KINDER BRISOL,MATUTINO,ISABEL LA CATOLICA NO. 799,ALAMOS,BENITO JUAREZ,Particular,"ISABEL LA CATOLICA NO. 799, ALAMOS, BENITO JUAREZ",19.393599,-99.1418751,"19.393599,-99.1418751"
Preescolar,COLEGIO MONTEVERDE,MATUTINO,AV. SANTA LUCIA NO. 260,CLUB DE GOLF PRADOS DE LA MONTAÑA,CUAJIMALPA DE MORELOS,Particular,"AV. SANTA LUCIA NO. 260, CLUB DE GOLF PRADOS DE LA MONTAÑA, CUAJIMALPA DE MORELOS",19.3564739,-99.2662522,"19.3564739,-99.2662522"
Preescolar,YOLLOITTA,MATUTINO,"RETORNO 1 DE SUR 12 ""C"" NO. 46",AGRICOLA ORIENTAL,IZTACALCO,Particular,"RETORNO 1 DE SUR 12 ""C"" NO. 46, AGRICOLA ORIENTAL, IZTACALCO",19.3940628,-99.0648731,"19.3940628,-99.0648731"
Preescolar,COLEGIO BENEMERITO DE LAS AMERICAS,MATUTINO,PLAYA COPACABANA MZ. 30 LT. 3,LA POLVORILLA,IZTAPALAPA,Particular,"PLAYA COPACABANA MZ. 30 LT. 3, LA POLVORILLA, IZTAPALAPA",19.3217092,-99.0486605,"19.3217092,-99.0486605"
Preescolar,MONTESSORI BABYS HOUSE,MATUTINO,GUANABANA NO.  331,NUEVA SANTA MARIA,AZCAPOTZALCO,Particular,"GUANABANA NO.  331, NUEVA SANTA MARIA, AZCAPOTZALCO",19.4706161,-99.1676197,"19.4706161,-99.1676197"
Preescolar,INSTITUTO AMADEUS,MATUTINO,BECAL MZA. 47 LT. 4,HEROES DE PADIERNA,TLALPAN,Particular,"BECAL MZA. 47 LT. 4, HEROES DE PADIERNA, TLALPAN",19.2814839,-99.2247518,"19.2814839,-99.2247518"
Preescolar,COLEGIO MARK TWAIN,MATUTINO,OCASO MZ. 9 LT. 11,VALLE DE LUCES,IZTAPALAPA,Particular,"OCASO MZ. 9 LT. 11, VALLE DE LUCES, IZTAPALAPA",19.3798546,-99.1049144,"19.3798546,-99.1049144"
Preescolar,CENTRO DE DESARROLLO INFANTIL MUNDO MAGICO,MATUTINO,PROLONGACION CANAL DE MIRAMONTES NO. 102,SAN BARTOLO EL CHICO,TLALPAN,Particular,"PROLONGACION CANAL DE MIRAMONTES NO. 102, SAN BARTOLO EL CHICO, TLALPAN",19.2854426,-99.1321139,"19.2854426,-99.1321139"
Preescolar,KINDERGYM,MATUTINO,SAN FRANCISCO NO. 728 Y 730,DEL VALLE,BENITO JUAREZ,Particular,"SAN FRANCISCO NO. 728 Y 730, DEL VALLE, BENITO JUAREZ",19.3722184,-99.1755862,"19.3722184,-99.1755862"
Preescolar,BABY KINGDOM DEL VALLE,MATUTINO,PITAGORAS NO. 541,NARVARTE,BENITO JUAREZ,Particular,"PITAGORAS NO. 541, NARVARTE, BENITO JUAREZ",19.3926472,-99.1580045,"19.3926472,-99.1580045"
Preescolar,KINDER MONTESSORI YAMILETH,MATUTINO,1ER. RETORNO DE MARIQUITA SANCHEZ NO. 23,UNIDAD OBRERO HABITACIONAL CTM CULHUACAN VIII A,COYOACAN,Particular,"1ER. RETORNO DE MARIQUITA SANCHEZ NO. 23, UNIDAD OBRERO HABITACIONAL CTM CULHUACAN VIII A, COYOACAN",19.3259904,-99.1105792,"19.3259904,-99.1105792"
Preescolar,INSTITUTO PEDAGOGICO GISELLE,MATUTINO,AV. TLAHUAC NO. 6121,MIGUEL HIDALGO,TLAHUAC,Particular,"AV. TLAHUAC NO. 6121, MIGUEL HIDALGO, TLAHUAC",19.2995254,-99.0440821,"19.2995254,-99.0440821"
Preescolar,COLEGIO AMERICANO MONARCA,MATUTINO,RAMON FABIE NO. 221,ASTURIAS,CUAUHTEMOC,Particular,"RAMON FABIE NO. 221, ASTURIAS, CUAUHTEMOC",19.4042156,-99.1329545,"19.4042156,-99.1329545"
Preescolar,CENTRO DE EDUCACIÓN INFANTIL PIPIOLO,MATUTINO,J. GARCIA IZCAZBALCETA NO. 25,SAN RAFAEL,CUAUHTEMOC,Particular,"J. GARCIA IZCAZBALCETA NO. 25, SAN RAFAEL, CUAUHTEMOC",19.4410184,-99.1609885,"19.4410184,-99.1609885"
Preescolar,CENTRO EDUCATIVO YOSEDARI,MATUTINO,CALZ. TENORIOS NO. 300,RESIDENCIAL EX-HACIENDA COAPA,TLALPAN,Particular,"CALZ. TENORIOS NO. 300, RESIDENCIAL EX-HACIENDA COAPA, TLALPAN",19.2924129,-99.1167479,"19.2924129,-99.1167479"
Preescolar,COLEGIO WILLIAM JAMES / YOLLIHUE,MATUTINO,CANDELARIA NO. 152,ATLANTIDA,COYOACAN,Particular,"CANDELARIA NO. 152, ATLANTIDA, COYOACAN",19.3399758,-99.145318,"19.3399758,-99.145318"
Preescolar,JIREH,MATUTINO,ARROLLO DE AHUEHUETES NO.45,LA ESCALERA,GUSTAVO A. MADERO,Particular,"ARROLLO DE AHUEHUETES NO.45, LA ESCALERA, GUSTAVO A. MADERO",19.5110842,-99.138906,"19.5110842,-99.138906"
Preescolar,CENTRO EDUCATIVO MARCELINO CHAMPAGNAT,MATUTINO,EDUARDO GARAY NO. 25,MIGUEL HIDALGO,TLALPAN,Particular,"EDUARDO GARAY NO. 25, MIGUEL HIDALGO, TLALPAN",19.2858592,-99.1905749,"19.2858592,-99.1905749"
Preescolar,JARDIN DE NIÑOS PIOLIN Y SILVESTRE,MATUTINO,NORTE 70 NO.6227,GERTRUDIS SANCHEZ,GUSTAVO A. MADERO,Particular,"NORTE 70 NO.6227, GERTRUDIS SANCHEZ, GUSTAVO A. MADERO",19.4710692,-99.1050546,"19.4710692,-99.1050546"
Preescolar,SHARON CHRISTA MC. AULIFFE,MATUTINO,CERRO NEGRO MZ.17 LT.16,CRUZ DEL FAROL,TLALPAN,Particular,"CERRO NEGRO MZ.17 LT.16, CRUZ DEL FAROL, TLALPAN",19.2699211,-99.2130476,"19.2699211,-99.2130476"
Preescolar,MI PEQUEÑO MUNDO,MATUTINO,SUR 121 NO. 248,IZTACALCO,IZTACALCO,Particular,"SUR 121 NO. 248, IZTACALCO, IZTACALCO",19.3883352,-99.1051439,"19.3883352,-99.1051439"
Preescolar,COLEGIO INGLES ELIZABETH BRASH,MATUTINO,PLAZA JUAREZ NO. 5,SAN ANDRES MIXQUIC,TLAHUAC,Particular,"PLAZA JUAREZ NO. 5, SAN ANDRES MIXQUIC, TLAHUAC",19.2245881,-98.9651398,"19.2245881,-98.9651398"
Preescolar,KINDER MARGARITA MORENO,MATUTINO,ÁLVARO OBREGON 2  (ANTES 20),LA MALINCHE,LA MAGDALENA CONTRERAS,Particular,"ÁLVARO OBREGON 2  (ANTES 20), LA MALINCHE, LA MAGDALENA CONTRERAS",19.3540015,-99.2138107,"19.3540015,-99.2138107"
Preescolar,BABY BEE,TIEMPO COMPLETO,AV. CAMPOS ELISEOS NO. 136,BOSQUES DE CHAPULTEPEC,MIGUEL HIDALGO,Particular,"AV. CAMPOS ELISEOS NO. 136, BOSQUES DE CHAPULTEPEC, MIGUEL HIDALGO",19.427148,-99.1979599,"19.427148,-99.1979599"
Preescolar,CENTRO ESCOLAR YAOCALLI,MATUTINO,CERRADA DE LEON NO. 54,MIGUEL HIDALGO,TLALPAN,Particular,"CERRADA DE LEON NO. 54, MIGUEL HIDALGO, TLALPAN",19.2905985,-99.1847215,"19.2905985,-99.1847215"
Preescolar,WAYNE SKINNER,MATUTINO,ORIENTE 176 NO. 203,MOCTEZUMA 2A SECCION,VENUSTIANO CARRANZA,Particular,"ORIENTE 176 NO. 203, MOCTEZUMA 2A SECCION, VENUSTIANO CARRANZA",19.4279077,-99.0950189,"19.4279077,-99.0950189"
Preescolar,CENTRO DE DESARROLLO INFANTIL PRINCESS,MATUTINO,SUR 155 NO. 1919,GABRIEL RAMOS MILLAN,IZTACALCO,Particular,"SUR 155 NO. 1919, GABRIEL RAMOS MILLAN, IZTACALCO",19.3906035,-99.0960242,"19.3906035,-99.0960242"
Preescolar,ESCUELA CRISTOBAL COLON,MATUTINO,CALZADA DE LOS MISTERIOS NO. 25,GUSTAVO A. MADERO,GUSTAVO A. MADERO,Particular,"CALZADA DE LOS MISTERIOS NO. 25, GUSTAVO A. MADERO, GUSTAVO A. MADERO",19.4869261,-99.1178449,"19.4869261,-99.1178449"
Preescolar,CENTRO EDUCATIVO INTERKIDS,MATUTINO,AV. ACOXPA NO. 926,NARCISO MENDOZA,TLALPAN,Particular,"AV. ACOXPA NO. 926, NARCISO MENDOZA, TLALPAN",19.2898208,-99.1173172,"19.2898208,-99.1173172"
Preescolar,COLEGIO ALGARI,MATUTINO,AGUSTIN DIAZ NO. 20,MIGUEL HIDALGO,TLALPAN,Particular,"AGUSTIN DIAZ NO. 20, MIGUEL HIDALGO, TLALPAN",19.2846917,-99.1891237,"19.2846917,-99.1891237"
Preescolar,CENTRO EDUCATIVO ANDRES HENESTROSA,MATUTINO,AV. MEXICO NO. 934,HEROES DE PADIERNA,LA MAGDALENA CONTRERAS,Particular,"AV. MEXICO NO. 934, HEROES DE PADIERNA, LA MAGDALENA CONTRERAS",19.314338,-99.2235516,"19.314338,-99.2235516"
Preescolar,INSTITUTO MEXICANO REGINA,MATUTINO,RIVERA DE CUPIA NO.70,REAL DE LAS LOMAS,MIGUEL HIDALGO,Particular,"RIVERA DE CUPIA NO.70, REAL DE LAS LOMAS, MIGUEL HIDALGO",19.3984409,-99.2389526,"19.3984409,-99.2389526"
Preescolar,BÚSTER,MATUTINO,VILLA FRUELA MZ. 54 A/G SEC E LT. 1,DESARROLLO URBANO QUETZALCOATL,IZTAPALAPA,Particular,"VILLA FRUELA MZ. 54 A/G SEC E LT. 1, DESARROLLO URBANO QUETZALCOATL, IZTAPALAPA",19.3259326,-99.0377718,"19.3259326,-99.0377718"
Preescolar,CENTRO AZCAPOTZALCO DE DESARROLLO INTEGRAL,MATUTINO,AV. AZCAPOTZALCO NO. 486,NEXTENGO,AZCAPOTZALCO,Particular,"AV. AZCAPOTZALCO NO. 486, NEXTENGO, AZCAPOTZALCO",19.4763541,-99.1872132,"19.4763541,-99.1872132"
Preescolar,CENTRO EDUCATIVO EDUCA MATES,MATUTINO,CAMINO ANT. A SAN PEDRO MARTIR NO. 315,SAN PEDRO MARTIR,TLALPAN,Particular,"CAMINO ANT. A SAN PEDRO MARTIR NO. 315, SAN PEDRO MARTIR, TLALPAN",,,
Preescolar,COLEGIO ALEJANDRO TASSONI,MATUTINO,JORGE ENCISO NO. 1557,HEROES DE CHURUBUSCO,IZTAPALAPA,Particular,"JORGE ENCISO NO. 1557, HEROES DE CHURUBUSCO, IZTAPALAPA",19.359319,-99.1170505,"19.359319,-99.1170505"
Preescolar,JARDIN DE NIÑOS SOLEIL,MATUTINO,NORTE 15 NO. 5226,NUEVA VALLEJO,GUSTAVO A. MADERO,Particular,"NORTE 15 NO. 5226, NUEVA VALLEJO, GUSTAVO A. MADERO",19.4853794,-99.1459341,"19.4853794,-99.1459341"
Preescolar,COLEGIO AMAUTA,MATUTINO,"CALLE AREQUIPA NO. 112 Y MONTEVIDEO NO.132, ESQ. BOGOTA",LINDAVISTA,GUSTAVO A. MADERO,Particular,"CALLE AREQUIPA NO. 112 Y MONTEVIDEO NO.132, ESQ. BOGOTA, LINDAVISTA, GUSTAVO A. MADERO",,,
Preescolar,IL MIO MONDO MONTESSORI,MATUTINO,"MARIANO ESCOBEDO NO. 113, 115, Y 117",ANAHUAC I,MIGUEL HIDALGO,Particular,"MARIANO ESCOBEDO NO. 113, 115, Y 117, ANAHUAC I, MIGUEL HIDALGO",19.4479903,-99.1824646,"19.4479903,-99.1824646"
Preescolar,PROFRA. GUILLERMINA LUTTEROTH,MATUTINO,2A. CERRADA DE MIXTECAS NO. 4,TLACUITLAPA,ALVARO OBREGON,Particular,"2A. CERRADA DE MIXTECAS NO. 4, TLACUITLAPA, ALVARO OBREGON",19.3520409,-99.2380189,"19.3520409,-99.2380189"
Preescolar,COLEGIO ATID,MATUTINO,AV. CARLOS ECHANOVE NO. 224,LOMAS DE VISTA HERMOSA,CUAJIMALPA DE MORELOS,Particular,"AV. CARLOS ECHANOVE NO. 224, LOMAS DE VISTA HERMOSA, CUAJIMALPA DE MORELOS",19.3703129,-99.2779191,"19.3703129,-99.2779191"
Preescolar,AMERICAS UNIDAS,MATUTINO,CHIHUAHUA NO. 23,ROMA SUR,CUAUHTEMOC,Particular,"CHIHUAHUA NO. 23, ROMA SUR, CUAUHTEMOC",19.4185602,-99.1553665,"19.4185602,-99.1553665"
Preescolar,JARDIN DE NIÑOS FRANCISCO LARROYO,MATUTINO,AV. TLAHUAC NO. 7367,SANTA CECILIA,TLAHUAC,Particular,"AV. TLAHUAC NO. 7367, SANTA CECILIA, TLAHUAC",19.2792275,-99.0083257,"19.2792275,-99.0083257"
Preescolar,ERNESTO RUTHERFORD,MATUTINO,JUSTINA NO. 89,SAN LORENZO XICOTENCATL,IZTAPALAPA,Particular,"JUSTINA NO. 89, SAN LORENZO XICOTENCATL, IZTAPALAPA",19.3846403,-99.0273694,"19.3846403,-99.0273694"
Preescolar,INSTITUTO NACE,MATUTINO,ÚRSULO GALVÁN NO. 90,SANTA CRUZ MEYEHUALCO,IZTAPALAPA,Particular,"ÚRSULO GALVÁN NO. 90, SANTA CRUZ MEYEHUALCO, IZTAPALAPA",19.3384865,-99.0463764,"19.3384865,-99.0463764"
Preescolar,ESHDEI ESCUELA HUMANISTA DE EDUCACIÓN INTEGRAL,MATUTINO,EMILIANO ZAPATA NO. 63,SAN JERONIMO ACULCO,LA MAGDALENA CONTRERAS,Particular,"EMILIANO ZAPATA NO. 63, SAN JERONIMO ACULCO, LA MAGDALENA CONTRERAS",19.3208696,-99.2245995,"19.3208696,-99.2245995"
Preescolar,COLEGIO LIBERTAD,MATUTINO,PALMAS NO. 13,SANTA MARIA AZTAHUACAN,IZTAPALAPA,Particular,"PALMAS NO. 13, SANTA MARIA AZTAHUACAN, IZTAPALAPA",19.3491626,-99.0226842,"19.3491626,-99.0226842"
Preescolar,ANNA SANDER S,MATUTINO,CALLE 57 NO. 107,UNIDAD SANTA CRUZ MEYEHUALCO,IZTAPALAPA,Particular,"CALLE 57 NO. 107, UNIDAD SANTA CRUZ MEYEHUALCO, IZTAPALAPA",19.3482194,-99.0449718,"19.3482194,-99.0449718"
Preescolar,GOTITAS DE AMOR,MATUTINO,MIGUEL ALEMAN MZ. 63 LT. 15,PRESIDENTES DE MEXICO,IZTAPALAPA,Particular,"MIGUEL ALEMAN MZ. 63 LT. 15, PRESIDENTES DE MEXICO, IZTAPALAPA",19.3302614,-99.059713,"19.3302614,-99.059713"
Preescolar,TIYOLI,MATUTINO,CARRETERA MEXICO TOLUCA NO. 5668,LOCAXCO,CUAJIMALPA DE MORELOS,Particular,"CARRETERA MEXICO TOLUCA NO. 5668, LOCAXCO, CUAJIMALPA DE MORELOS",19.3557551,-99.2916101,"19.3557551,-99.2916101"
Preescolar,ESCUELA LEONESA,MATUTINO,MOCTEZUMA NO. 25,SANTA LUCIA,ALVARO OBREGON,Particular,"MOCTEZUMA NO. 25, SANTA LUCIA, ALVARO OBREGON",19.3601479,-99.2501943,"19.3601479,-99.2501943"
Preescolar,ROSITA,MATUTINO,CALLE 15 NO. 16,SANTA CRUZ MEYEHUALCO,IZTAPALAPA,Particular,"CALLE 15 NO. 16, SANTA CRUZ MEYEHUALCO, IZTAPALAPA",19.3443341,-99.0355675,"19.3443341,-99.0355675"
Preescolar,INFANCIA FELIZ,MATUTINO,AV. HIDALGO NO. 651,SAN MIGUEL AMPLIACION,IZTAPALAPA,Particular,"AV. HIDALGO NO. 651, SAN MIGUEL AMPLIACION, IZTAPALAPA",19.3523693,-99.0704214,"19.3523693,-99.0704214"
Preescolar,ANNA FREUD,MATUTINO,IGNACIO L. VALLARTA NO. 184,JACARANDAS,IZTAPALAPA,Particular,"IGNACIO L. VALLARTA NO. 184, JACARANDAS, IZTAPALAPA",19.3500722,-99.0513455,"19.3500722,-99.0513455"
Preescolar,JARDIN DE NIÑOS TOWI,MATUTINO,PRIVADA AJUSCO (ZACAPULAS) NO.18,SANTA URSULA XITLA,TLALPAN,Particular,"PRIVADA AJUSCO (ZACAPULAS) NO.18, SANTA URSULA XITLA, TLALPAN",,,
Preescolar,MONTE ALBAN,MATUTINO,AVENIDA 4 MZ. 8 LT. 8,RENOVACION,IZTAPALAPA,Particular,"AVENIDA 4 MZ. 8 LT. 8, RENOVACION, IZTAPALAPA",19.3698884,-99.0490349,"19.3698884,-99.0490349"
Preescolar,INSTITUTO PEDAGOGICO IBEROAMERICANO,MATUTINO,CAMPESINOS NO. 134,GRANJAS ESMERALDA,IZTAPALAPA,Particular,"CAMPESINOS NO. 134, GRANJAS ESMERALDA, IZTAPALAPA",19.3537417,-99.1181302,"19.3537417,-99.1181302"
Preescolar,COLEGIO LUZ BRINGAS PREESCOLAR,MATUTINO,ESTRELLA NO. 1,SAN JUAN XALPA,IZTAPALAPA,Particular,"ESTRELLA NO. 1, SAN JUAN XALPA, IZTAPALAPA",19.336373,-99.0798867,"19.336373,-99.0798867"
Preescolar,CERVANTES,MATUTINO,AV. TLAHUAC NO. 3431,CULHUACAN,IZTAPALAPA,Particular,"AV. TLAHUAC NO. 3431, CULHUACAN, IZTAPALAPA",19.3434145,-99.1081134,"19.3434145,-99.1081134"
